region,text
태백,"【강릉】지속되는 가뭄으로 어려움을 겪고 있는 강릉시에 가뭄 위기 극복을 기원하는 성금 및 후원 기탁이 이어지고 있다. 태백시는 26일 강릉시를 찾아 1일 46톤의 응원급수를 9월 한 달간 지원하기로 약속했다. 이는 총 1,380톤 규모로 가뭄 상황으로 어려움을 겪는 강릉시에 큰 도움이 될 전망이다. 강원특별자치도상공회의소협의회도 26일 강릉시에 생수 500㎖ 1만 5,000병을 기탁하며 도움의 손길을 보탰다. 강릉상공회의소는 지난 25일 가뭄극복 시민설명회 자리에서 강릉시에 ‘가뭄 극복을 위한 생수 나눔 성금’ 500만 원을 기탁했다. 삼척에스엠호텔도 ‘가뭄 극복 생수 나눔 성금’ 300만 원도 기탁, 지역사회에 도움을 줬다. 김홍규 강릉시장은 “어려울 때 손 내밀어주신 분들의 따뜻한 마음에 깊은 감사의 마음을 전한다”고 말했다."
태백,"태백시는 최근 가뭄으로 생활용수 부족을 겪고 있는 강릉시를 지원하기 위해 급수차 지원에 나섰다. 이상호 태백시장은 26일 강릉시청에서 김홍규 강릉시장과 급수차 지원 전달식을 갖고, 한 달간 급수차 2대를 매일 2회 강릉시에 파견해 급수 지원을 실시한다고 밝혔다. 태백시는 가뭄이 장기화될 경우 지원 기간을 연장하고, 필요 시 생수 지원 등 추가 지원책도 검토할 계획이다. 이번 지원은 급수난으로 어려움을 겪는 강릉 시민들에게 실질적인 도움을 제공하고, 지자체 간 협력을 통해 위기 상황을 함께 극복하기 위해 마련됐다. 이상호 태백시장은 “태백시는 2009년 가뭄으로 제한급수를 경험하며 다른 지자체로부터 도움을 받은 바 있다”며, “이번 강릉시 지원은 그때 받은 도움을 되돌려 주는 마음으로, 가뭄으로 어려움을 겪는 시민들에게 실질적인 힘이 되길 바란다”고 말했다. 한편, 강릉시는 올해 들어 계속된 가뭄과 저수율 급감으로 인근 저수지와 수도시설 운영에 차질을 빚고 있으며, 당국은 비상급수 대책 마련에 총력을 기울이고 있다."
태백,"강원 강릉시에 가뭄 극복을 위한 지원이 이어지고 있다. 강원특별자치도상공회의소협의회가 생수 1만5000병을 지원했다. 2025.08.26 태백시는 26일 강릉시를 방문해 9월 한 달간 하루 46t의 응원 급수를 지원하기로 약속했다. 총 1380t 규모의 지원으로 강릉시의 가뭄 문제 해결에 큰 도움이 될 것으로 전망된다. 같은 날 강원특별자치도상공회의소협의회는 500㎖ 생수 1aks5000병을 강릉시에 기탁했다. 또한, 강릉상공회의소는 지난 25일 열린 가뭄 극복 시민설명회에서 생수 나눔을 위한 성금 500만 원을 강릉시에 전달했다. 김홍규 강릉시장은 ""어려울 때 손 내밀어주신 분들의 따뜻한 마음에 깊은 감사의 마음을 전한다""고 말했다."
태백,"극심한 가뭄을 겪고 있는 강원도 강릉시에 다른 지자체들의 급수 지원이 이어지고 있습니다. 태백시는 다음 달 한 달 동안 하루 46톤, 모두 1,380톤의 물을 공급하기로 했고, 춘천시는 어제 176톤을 지원했습니다. 강릉의 주 상수원 오봉저수지 저수율은 현재 17%대로, 15% 이하로 떨어지면 평창과 동해, 양양도 하루 1,200톤의 물을 공급할 계획입니다. YTN 송세혁"
태백,"26일 오전 7시 21분쯤 화천군 사내면의 한 도로에서 전신주가 넘어져 경찰과 소방 등 관계당국이 안전 조치를 벌였다. 강원소방 제공강원 영서지역에 폭우가 쏟아진 26일, 영동지역은 극심한 가뭄에 더해 산불까지 발생하며 강원 전역이 '기상 양극화 현상'으로 몸살을 앓았다. 시간당 74㎜에 달하는 장대비가 내린 화천군 사내면은 전날 밤부터 내린 폭우에 피해가 잇따른 반면 저수지가 바닥을 드러낸 강릉지역은 단 1㎜의 강수량을 기록했다. 영서 폭우·영동 가뭄…강원 전역 자연 재해로 '몸살' 26일 오전 7시 21분쯤 화천군 사내면의 한 주택이 침수돼 소방당국이 배수 작업을 벌였다. 강원소방 제공강원특별자치도소방본부에 따르면 이날 오전 7시 21분쯤 화천군 사내면의 한 주택이 침수돼 소방당국이 배수 작업을 벌였다. 같은날 오전 7시 21분쯤 화천군 사내면의 한 도로에서 전신주가 넘어져 경찰과 소방 등 관계당국이 안전 조치를 벌였다. 전날 오후 9시 16분쯤 화천군청 인근 도로 공사 현장에서 간이화장실 구조물이 도로에 떨어졌다는 신고가 접수돼 소방당국이 출동하기도 했다. 전날부터 이날 오전 11시까지 내린 비의 양은 사내 144㎜, 철원 113㎜, 신북 57.3㎜, 해안 55㎜, 홍천 44.5㎜로 집계됐다. 반면 극심한 가뭄으로 기우제까지 지내던 강릉은 이날 불과 1㎜의 강수량에 그쳤다. 속초 19㎜, 양양 하조대 17.5㎜ 역시 영서 지역과 비교하면 턱없이 적은 수치다. 삼척에서는 '여름 산불'까지 발생했다. 이날 오전 6시 53분쯤 삼척시 가곡면 오목리 야산에서 산불이 발생해 산림당국이 헬기 11대와 장비 56대, 인력 200여 명을 투입해 진화에 나섰다. 이번 산불은 전날 70대 주민이 말벌집을 태우려다 야산으로 불이 옮겨 붙었던 곳에서 재발화한 것으로 파악됐다. 영서·영동 강수량 차이 '최대 5배'…푄현상 영향 극한 가뭄으로 바닥까지 드러난 강릉 오봉저수지. 영서와 영동의 극단적 차이는 강수일수와 강수량 비교에서 뚜렷하게 드러난다. 기상청 관측자료에 따르면 지난달 1일부터 이날까지 영서지역은 철원 23일, 원주 20일, 춘천·홍천 19일 동안 비가 내렸다. 반면 영동은 동해 18일, 속초 15일, 강릉 14일에 그쳤다. 누적 강수량은 철원 583.5㎜, 춘천 528.6㎜, 홍천 368.5㎜, 원주 340.4㎜, 속초 244.4㎜, 강릉 169.3㎜, 동해 114.2㎜였다. 철원과 동해의 강수량 차이는 무려 5배를 넘었다. 태평양 고기압 가장자리에 위치해 고온 다습한 수증기가 다량 유입되면서 많은 비를 뿌린 영서지역과 달리 영동지역의 경우 '푄현상'이 가뭄에 결정적 역할을 했다. 푄현상은 바람이 산맥을 넘으며 고온건조해지는 현상을 일컫는데, 올해 여름 태백산맥을 넘은 남서풍이 영서지역에 비를 뿌리고 영동지역으로 넘어가면서 극심한 더위가 이어졌기 때문이다. 기상청 관계자는 ""이번 기상 현상의 경우 북쪽 찬 상층골이 지나가며 영서지역에 많은 비가 내린 반면 영동지역은 푄현상으로 동쪽에서 강수를 뿌리고 넘어오면서 강수량이 적었다""고 설명했다. ""기후위기 전형, 온실가스 감축·사회 안전망 병행해야"" 강릉시 주요 상수원인 오봉저수지 상류. 연합뉴스집중호우와 가뭄, 산불이 동시에 발생하는 기상 양극화 현상을 두고 전문가들은 기후위기의 전형적인 모습이라고 진단했다. 이지언 환경운동연합 에너지기후위원은 ""지구 온난화로 대기 온도가 올라가면서 강수 패턴이 왜곡되고 증발량이 늘고 있다""며 ""어떤 지역은 폭우로 범람하고 다른 지역은 극심한 물 부족에 시달리는 극단화 현상이 심해지고 있다""고 말했다. ""이미 지구 온도 상승은 불가피하기 때문에 사회가 극단적 기후에 적응할 수 있는 안전망이 필요하다""며 ""특히 노약자·취약계층이 주거·물·에너지 등 필수 자원에 안정적으로 접근할 수 있도록 재난 안전 시스템을 강화해야 한다""고 제언했다. 이 위원은 ""강원도는 산불과 가뭄 등 기후재난에 취약한 만큼 특별자치도의 지위를 활용해 독자적이고 선제적인 기후·에너지 전략을 마련해야 한다""며 ""무엇보다 온실가스를 줄이는 게 최우선""이라고 강조했다. 중·장기적 관점으로 봤을 때 동해안에 들어선 대형 화력발전소들이 물 부족 사태를 악화시킬 수 있다는 주장도 제기됐다. 이 위원은 ""발전소는 터빈을 돌리기 위해 반드시 담수를 써야 하고, 지하수·하천수를 활용한다""며 ""평상시에는 문제가 없지만 가뭄 시기에는 농업·생활용수와 충돌해 물 부족을 악화시킬 수 있다""고 말했다."
태백,"기자페이지 26일 행정안전부 중앙재난안전대책본부에 따르면, 이날 오전 5시 기준으로 세종, 경기, 충북, 충남, 전북 등 5개 시도에 호우 특보가 발효됨에 따라 중대본 1단계가 가동됐다. 윤호중 중대본부장은 “지하차도와 반지하주택 등 상습 침수 우려 지역에 대한 예찰과 주민 대피를 강화하라”고 지시했다. 이날 자정부터 오전 5시까지 누적 강수량은 충남 보령 삽시도가 133㎜로 가장 많았고, 천안 103㎜, 세종 94㎜, 철원 93㎜, 포천 93㎜ 등을 기록했다. 보령 삽시도에서는 한때 시간당 62㎜의 폭우가 내렸다. 세종 전의와 천안도 시간당 40㎜가 넘는 강한 비가 관측됐다. 이 과정에서 충남 보령 주택에서 물이 현관까지 차오르는 등 8건의 피해 신고가 접수됐고, 충남 공주에서는 낙뢰로 공공시설이 정전 피해를 입었다. 현재 북한산계룡산·변산반도 등 국립공원 132개 구간과 지하차도 2곳, 둔치주차장 10곳, 하천변 62곳이 출입 통제 중이다. 기상청은 수도권과 충청, 강원 일부 지역에 시간당 30∼80㎜의 집중호우가 이어질 것으로 전망했다. 이번 비로 폭염특보는 일부 해제되거나 완화되겠지만, 습도가 높아지면서 체감온도는 오히려 높아질 수 있다고 설명했다. 한편, 극심한 가뭄으로 생활·농업용수 공급에 어려움을 겪고 있는 강원 동해안에는 비가 거의 내리지 않았다. 비구름대가 태백산맥을 넘지 못하면서 강릉 지역에는 5㎜ 내외의 적은 비만 내려 오봉저수지 등 주요 상수원 고갈 상황은 계속될 것으로 보인다. 기상청 관계자는 “오늘 오후까지 많은 비가 예상돼 하천 수위 상승과 급류에 각별히 주의해야 한다”며 “특히 가뭄 지역에는 이번 비가 충분치 않아 당분간 용수난이 이어질 가능성이 크다”고 말했다."
태백,"한반도 서해안은 기록적인 폭우로 물난리가 나는데 태백산맥 너머 동쪽에는 수개월째 비가 오지 않아 마실 물도 부족한 가뭄이 이어지고 있다. 서쪽은 극한호우, 동쪽은 극한가뭄이 발생하는 근본적인 원인으로 지구온난화가 지목되고 있다. 올들어 비 피해는 서쪽에만 집중됐다.7월 하순에는 충청권과 남부지역에 역대급 폭우가 쏟아지면서 도로와 주택뿐 아니라 농경지들도 침수피해를 입었다. 당시 산청군 시천면에는 5일동안 무려 798㎜의 비가 퍼부었다. 8월초 내린 폭우도 남부지방에 집중됐다. 이 시기에 무안에는 1시간에 141㎜의 비가 쏟아졌다. 8월중순 폭우도 서울과 수도권에 집중되면서 피해를 낳았다. 인천 옹진군 덕적도에는 1시간에 149.2㎜의 비가 퍼부었다. 하지만 태백산맥 동쪽 강원지역은 비가 거의 내리지 않았다. 기후·지형적 특성으로 서쪽보다 동쪽의 강수량이 적긴 하지만 올해는 유독 그 차이가 극심하게 나타나고 있다. 최근 6개월동안 강릉에 내린 비의 양은 386.9㎜로, 평년의 절반 이하에 불과했다. 특히 최근 한달 강수량은 평년의 16.7%에 그치고 있다. 4개월 넘게 가뭄이 이어지고 있는 것이다. 식수를 조달하는 상수원도 바닥이 드러났다. 이 때문에 강릉시는 계량기를 50%로 잠그는 제한급수를 실시하고 있다. 지금 상황이 이어지면 28일쯤 75%까지 제한급수를 해야 할 상황이 된다. 하지만 9월까지 비소식은 없다는 예보다. 25일과 26일도 서울과 수도권 그리고 전국 대부분의 지역에서 비가 내리고 있지만 비가 가장 절실한 강릉은 찔끔 내리고 말았다. 26일 경기와 충청권은 시간당 30~50㎜의 극한호우가 쏟아질 것으로 예보돼 있고, 전북 10개 지역은 최대 80㎜ 폭우 예보에 호우특보까지 발효된 상태다. 그런데 강원 동해안 지역은 고작 5㎜의 가랑비만 내릴 전망이다. 서쪽에서 동쪽으로 이동하는 비구름대가 높은 태백산맥을 넘기 전에 대부분 비를 쏟아버리는 탓이다. 한반도 서쪽과 동쪽의 강우량이 이처럼 극단적인 차이를 보이는 것은 올해 강세를 보이는 북태평양고기압 때문이다. 한반도 남쪽에 위치한 북태평양고기압은 끊임없이 한반도로 습하고 더운 공기를 유입시키고 있다. 이 때문에 여름철 우리나라는 고온다습한 날씨가 이어진다. 대기가 더운 수증기가 가득차 있을 때 차고 건조한 공기가 유입되면 비가 내린다. 그런데 올해는 북태평양고기압 세력이 평년보다 강해서 비가 내릴 기회가 적었다. 실제로 올 6~7월 전국 평균 강수일수는 약 18.4일로 평년의 70%에 불과했다. 비가 내릴 기회가 적어지면서 한반도 상공의 대기는 마치 공기가 꽉찬 풍선같은 상태가 됐다. 이런 상태에서 남쪽에서 태풍 등 저기압이 몰려오거나 북서쪽에서 차고 건조한 공기가 유입되면 강한 비구름대가 형성되면서 풍선이 터지듯 극한호우를 퍼붓는 것이다. 기상청 관계자는 뉴스트리와의 통화에서 ""비를 쏟고 나면 대기 중 수증기는 줄어든다""면서 ""줄어든 수증기가 보충이 되어야 또 비를 내릴 힘이 생기는데 내륙지역과 동해안 지역에서는 이 수증기를 보충하기 어렵다""고 말했다. 이어 ""순식간에 비를 쏟아내고 건조해진 대기가 강릉으로 향하면서 가뭄이 이어진 것""이라고 설명했다. 동쪽과 서쪽의 극단적인 날씨 패턴이 발생한 직접적 원인은 북태평양고기압 때문이지만, 북태평양고기압이 올해 유독 그 세력이 강한 이유는 지구온난화에서 비롯됐다는 것이 전문가들의 공통된 의견이다. 지구가 뜨거워지면서 해수온이 상승하고, 이 상승한 해수온이 덥고 습한 공기를 북태평양고기압에 계속 공급해주고 있는 것이다. 올해 가마솥더위가 유난히 길어지고 있는 것도 이런 원인에서다. 전 기상청장인 서울대 남재철 교수는 ""고기압은 다양한 요인으로 세력히 발달하는데, 특히 해수면 온도가 상승하면 대량의 수증기가 대기 상층으로 이동해 고기압 세력 형성을 돕는다""며 ""올해 북태평양고기압이 평년보다 빠르고 강하게 세력을 확장·유지했는데, 해수면 온도 상승이 주된 원인이 아닐까 의심된다""고 말했다. Copyright @ NEWSTREE All rights reserved."
태백,"태백 무더위 평균 30도 기록 가뭄 겹쳐 ‘썩음병’ 배추 전멸 내년 농사 불투명 생계 위기 ‘기후위기 직격탄’ 배추산지 매봉산 태백 매봉산은 100㏊ 면적의 우리나라 여름배추 주산지 중 하나다. 올해 매봉산은 더위와 가뭄의 직격탄을 맞았다. 푸른빛이 돌아야 할 밭은 노랗게 썩은 배추로 가득찼다. 농민들은 먹고 살 길을 고민하고 있다 .기후위기는 이제 생존의 문제가 됐다. 1. 배추 썩어가는 매봉산을 가다 배추는 노랬다. 경사진 밭에 올라서자 바싹 마른 흙이 모래처럼 흘러내렸다. 가장자리부터 ‘녹아내린’ 배춧잎은 땅에 눌어붙어 있었다. 노란 배추밭에만 햇빛이 내리쬐는 듯 밝았다. 초록빛을 띤 건 모두 양배추였다. 20년째 배추농사를 지어온 이정만 씨는 이곳 매봉산에서 살고 있다. 21일 집 앞에서 만난 그는 “올해는 비가 거의 없었다”며 입을 뗐다. 집 뒷편 배추밭은 올해 ‘전멸’했다. 이 씨는 배춧잎을 열어보이며 “안쪽도 썩었다”며 “꿀통배추”라고 혀를 찼다. 반쪽시들음병, 무름병은 해마다 있었지만 올해는 속이 썩는 코병이 함께 왔다. 가뭄 때문에 배추가 칼슘을 제대로 흡수하지 못했다. 지난 7월 태백의 평균 최고기온은 30.1도를 기록했다. 평년값인 25.9도보다 4.1도 높은 수치다. 7월 강수량은 116.5㎜, 8월 강수량은 42.9㎜다. 이는 7월과 8월 평년 강수량의 각각 42%, 15% 수준이다. 더위와 가뭄이 덮치면서 이 씨는 올해 1650㎡ 면적에 심은 배추를 모두 갈아엎었다. 그는 “배추가 별볼일 없다”며 “아예 한 차도 못나왔다”고 했다. 이날도 굴착기 한 대가 ‘쿵, 쿵’ 소리를 내며 분주히 움직였다. 23일 오전 만난 밭 주인 정의철 씨는 “말도 말라”며 한숨부터 내쉬었다. 정 씨는 올해 4만3000㎡ 배추 농사 가운데 2만7000㎡를 갈아엎었다. 굴착기를 한 대 빌려 땅을 엎고, 망가진 배추를 옮기는 작업만 하루 210만원씩 든다. 그는 내년 농사가 불투명하다. 정 씨는 “이게 참 먹고 살길이 막막하니까…”라며 고개를 숙였다. 21일 오후 4시 매봉산은 굴착기 소리만 들렸다. 서울 가락시장의 배추 경매시간은 오후 11시. 250여㎞가 떨어진 서울까지는 3~4시간이 걸린다. “늦어도 오후 5시면 배추를 실은 차량이 서둘러 매봉산을 떠난다”는 게 박명순 매봉산 고랭지배추단지 회장의 말이다. 배추를 실은 화물차는커녕 수확작업을 하는 작업자도 찾아볼 수 없었다. 개의 댓글 댓글 정렬 BEST댓글 BEST 댓글 답글과 추천수를 합산하여 자동으로 노출됩니다. 내 댓글 모음"
