region,text
태백,"기압골 영향으로 수도권·강원내륙 많은 비 평년의 비 3분의 1만 내린 강릉, 계속 건조 남부지방 중심으로 이번 주도 33도 폭염 기압골 영향으로 전국이 흐리고 비가 오지만, 극심한 가뭄으로 '재난상태'가 선포된 강릉 등 강원동해안 지역에는 예상 강수량이 5㎜에 불과하겠다. 비가 오지 않는 남부지방 등은 체감온도가 33도 안팎까지 오르며 당분간 매우 덥겠다. 1일 기상청에 따르면 기압골 영향으로 이날 전국적으로 비가 오겠다. 이번 비는 경기남부와 강원중남부내륙·산지는 2일 새벽까지, 충청권은 오전까지, 남부지방과 제주는 오후까지 비가 이어질 전망이다. 대체로 흐리던 하늘은 2일 중부지방부터 점차 개고 구름이 많아지겠다. 이틀간 예상 강수량은 △서울·인천·경기, 서해5도, 강원내륙·산지 30~80㎜ △광주·전남, 부산·울산·경남 30~80㎜ △대전·세종·충남, 충북 20~60㎜ △전북, 제주 10~60㎜ △대구·경북, 울릉도·독도 5~60㎜ △강원동해안 5㎜ 미만이다. 이날 오후까지는 수도권을 중심으로 시간당 20~30㎜로 강한 비가 내리는 지역도 있겠다. 3일에 중부지방은 대체로 맑겠고, 남부지방은 오전부터 오후 사이 소나기가 내리는 곳이 있겠다. 예상 강수량은 전북, 광주·전남, 경남서부, 제주에서 5~40㎜다. 최근 가뭄이 심한 강릉 등 강원동해안은 이번주에도 큰 비 소식이 없고 무더위가 계속될 것으로 보인다. 올여름에는 주로 서풍 계열 바람이 불었는데, 태백산맥에 부딪히며 발생하는 '푄 현상'의 일종으로 산맥 서쪽에는 비가 오지만 동쪽에는 고온건조한 바람만 넘어가는 상황이 잦았다. 평년 대비 강원영동 지역 강수량이 3분의 1에 그치는 이유다. 당분간 남부지방을 중심으로 최고 체감온도가 33도 안팎으로 오르며 폭염이 이어지겠다. 이날 오전 기준으로도 남부지방 대부분과 강원동해안 지역에 폭염특보가 발령됐다. 이번 주중 낮 최고기온은 28~33도 범위로 무더위가 계속되겠다. 기사 URL이 복사되었습니다."
태백,"한국남부발전 삼척빛드림본부가 지난 8월 29일 최근 산불 피해로 어려움을 겪고 있는 삼척시 가곡면 일대에 구호물품을 긴급 지원하며 지역 사회에 따뜻한 온정을 전했다. 이번 지원은 예기치 못한 산불로 삶의 터전을 잃거나 불편을 겪는 이재민과 밤낮없이 화마와 싸우는 현장 구조요원들의 신속한 회복과 안전을 돕기 위해 마련되었다. 특히, 삼척빛드림본부 임직원들이 자발적으로 참여하여 그 의미를 더했다. 전달된 구호물품은 생필품과 식료품은 물론, 연일 지속되는 폭염 속에서 진화 작업을 벌이는 인력들의 건강을 고려한 폭염 예방물품 등으로 다양하게 구성되었다. 이 물품들은 산불 피해를 입은 지역 주민과 현장 진화 인력에게 즉각적으로 전달되어 실질적인 도움을 제공했다. 임경규 삼척빛드림본부장은 ""산불 진화를 위해 불철주야 애쓰시는 분들과 갑작스러운 피해로 어려움을 겪는 주민들에게 조금이나마 도움이 되고자 구호물품을 준비했다""며, ""피해를 입은 지역 주민들이 하루빨리 일상생활로 복귀하시기를 진심으로 바란다""고 위로와 격려의 메시지를 전했다. 한편, 한국남부발전 삼척빛드림본부의 이번 구호물품 지원은 지역사회와 상생하며 재난 극복에 동참하는 모범적인 사례로 평가받고 있으며, 피해 지역의 조속한 복구에 긍정적인 영향을 미칠 것으로 기대된다. 강릉해양경찰서, 송인학 경사 경위 승진 임용식 개최 강릉해양경찰서는 1일 오전 서장실에서 경찰관 승진임용식을 개최했다. 강릉해경에 따르면, 이날 승진 임용 대상자는 P~32정 소속 송인학 경사 단 1명으로, 경위로 한 계급 승진했다. 이날 임용식은 승진 대상자인 송 경위를 비롯해 박홍식 서장 및 각 과장 등 주요 지휘부가 참석한 가운데 진행됐다. 임명장 수여와 계급장 부착, 꽃다발 전달, 기념사진 촬영 순으로 행사가 마무리됐다. 승진한 송인학 경위는 ""축하해주신 선·후배 및 동료들에게 감사하다""며, ""계급이 올라간 만큼 더욱 책임감을 갖고 국민의 생명과 재산을 지키는 해양경찰관이 되겠다""고 소감을 밝혔다. 그는 국민 안전을 위한 새로운 각오를 다졌다. 박홍식 서장은 송 경위에게 ""영예로운 승진을 진심으로 축하한다""며, ""주어진 임무에 책임감과 사명감으로 맡은 업무에 최선을 다해주길 바란다""고 당부의 말을 전했다. 태백시의회, 강릉시 가뭄 극복에 '생수 7천병' 온정의 손길 태백시의회가 1일 강릉시의 극심한 가뭄으로 고통받는 시민들을 돕기 위해 의원들과 직원들이 모금한 성금으로 생수 7000병을 기탁하며 따뜻한 나눔의 손길을 내밀었다. 이날 열린 기탁식에는 고재창 태백시의회 의장을 비롯한 의원 및 의회사무과 직원이 직접 참석해 그 의미를 더했다. 고재창 의장은 기탁식에서 태백시의 과거 가뭄 극복 경험을 되짚으며 강릉시민의 어려움에 깊이 공감했다. 그는 ""우리 태백시도 지난 2009년 겨울 극심한 가뭄으로 물 부족을 겪어 누구보다 그 힘든 생활을 잘 알고 있다""고 말했다. 이어 고 의장은 ""당시 온 국민으로부터 도움을 받아 위기를 극복했다""며, ""이번 생수 지원이 강릉시민의 가뭄 극복에 조금이나마 도움이 되기를 바란다""고 전했다. ©'5개국어 글로벌 경제신문' 아주경제."
태백,"AD 올여름, 전국 평균 하루 최고 기온이 사상 최고를 기록했습니다. 특히 가뭄이 심한 강릉 지역은 폭염과 열대야 일수가 기상 관측이래 114년 만에 가장 많았습니다. 의 보도입니다. 초반부터 역대급 더위로 시작한 올여름. 폭염과 호우가 반복되며 가마솥 더위가 잦았던 탓에 유난히 습도 높은 더위가 활동을 힘들게 했습니다. 9월이 시작했지만, 계절의 시계는 여전히 가을이 아닌 늦여름에 가깝습니다. 실제로 올해 여름 우리나라를 찾아온 더위의 기세는 역대 여름을 능가한 것으로 나타났습니다. 기상청이 지난 6월부터 8월까지 전국 평균 기온을 분석한 결과, 하루 최고 기온이 30.7도, 최저 기온은 21.9도로 모두 역대 1위를 기록했습니다. 올여름 한낮은 물론 밤 더위까지 지난해를 뛰어넘어, 기상 관측이래 신기록을 세운 겁니다. 특히 가뭄이 심한 강릉 지역은 6월 이후 폭염과 열대야 일수까지 모두 40일 이상을 기록해 114년 만에 가장 많았던 것으로 나타났습니다. 역대급 더위 기록은 9월에도 이어질 전망입니다. 기상청은 이달까지 예년 기온을 웃돌면서 다소 더운 날씨가 이어지고, 특히 가뭄이 극심한 영동 지방은 건조한 날씨가 이어지며 메마른 날씨가 더 심화할 수 있다며 지속적인 대비와 경계를 당부했습니다. YTN 정혜윤입니다. 영상편집 : 이은경 디자인 : 임샛별 YTN 정혜윤 ※ '당신의 제보가 뉴스가 됩니다' YTN 검색해 채널 추가 02-398-8585 올여름, 전국 평균 하루 최고 기온이 사상 최고를 기록했습니다. 특히 가뭄이 심한 강릉 지역은 폭염과 열대야 일수가 기상 관측이래 114년 만에 가장 많았습니다. 의 보도입니다. 초반부터 역대급 더위로 시작한 올여름. 폭염과 호우가 반복되며 가마솥 더위가 잦았던 탓에 유난히 습도 높은 더위가 활동을 힘들게 했습니다. 9월이 시작했지만, 계절의 시계는 여전히 가을이 아닌 늦여름에 가깝습니다. 실제로 올해 여름 우리나라를 찾아온 더위의 기세는 역대 여름을 능가한 것으로 나타났습니다. 기상청이 지난 6월부터 8월까지 전국 평균 기온을 분석한 결과, 하루 최고 기온이 30.7도, 최저 기온은 21.9도로 모두 역대 1위를 기록했습니다. 올여름 한낮은 물론 밤 더위까지 지난해를 뛰어넘어, 기상 관측이래 신기록을 세운 겁니다. 특히 가뭄이 심한 강릉 지역은 6월 이후 폭염과 열대야 일수까지 모두 40일 이상을 기록해 114년 만에 가장 많았던 것으로 나타났습니다. 역대급 더위 기록은 9월에도 이어질 전망입니다. 기상청은 이달까지 예년 기온을 웃돌면서 다소 더운 날씨가 이어지고, 특히 가뭄이 극심한 영동 지방은 건조한 날씨가 이어지며 메마른 날씨가 더 심화할 수 있다며 지속적인 대비와 경계를 당부했습니다. YTN 정혜윤입니다. 영상편집 : 이은경 디자인 : 임샛별 YTN 정혜윤 ※ '당신의 제보가 뉴스가 됩니다' YTN 검색해 채널 추가 02-398-8585"
태백,"'최악 가뭄' 재난사태 선포 오봉저수지 한달내 고갈 위기…군·소방 물탱크 활용 물 공급 전국가적 물나눔운동도 전개…당분간 강수 전망 없어 '답답' 강릉 주민들의 식수로 활용되는 오봉저수지가 한 달 안에 고갈될 위기에 처하자 '재난사태'로 선포됐다. 정부는 물탱크를 활용해 운반급수를 공급하고 인근 하천수를 적극 활용한다는 입장이지만, 단기적으로 활용할 수 있는 대책이 제한적이라 해결이 쉽지 않을 것으로 우려된다. 한국농어촌공사 농촌용수종합정보시스템에 따르면 31일 오봉저수지 저수율은 14.9%로 전날 대비 0.4%P 떨어졌다. 지난달 초에 30% 수준이었던 점을 감안하면 급격한 하락세다. 오봉저수지는 강릉 지역 생활용수의 87%를 공급하고 있다. 강릉은 지난달 20일 제한급수를 통해 수도 계량기를 50%까지 잠갔다가 27일부터 75%로 강화했지만 지속되는 가뭄에 저수율은 속절없이 떨어지고 있다. 이에 따라 정부는 지난달 30일 오후 7시부로 강원도 강릉시 일원에 재난사태를 선포하고, 범정부적 대응에 나섰다. 재난사태는 주로 산불에 대응하던 조치로 가뭄에 선포된 것은 이번이 처음이다. 피해가 발생한 뒤 국가 차원에서 대규모 비용 등을 지원하는 '특별재난지역'과 달리, 재난사태는 정부가 인력·장비·물자 등을 동원해 응급 지원에 나서는 것이다. 정부는 우선 군·소방 물탱크를 활용해 운반급수를 공급하고 인근 하천수를 활용하는 등 가용한 수원을 확대 공급한다. 소방탱크차 50대를 통해 하루 2000톤을 추가 급수할 수 있을 것으로 전망된다. 먹는 물 공급 확대를 위해서는 전국가적 물나눔 운동도 전개한다. 강릉시의 여름철 생활용수는 1일 약 10만톤이며, 제한급수 등을 통해 8만톤으로 조정 중이다. 오봉저수지의 현재 저수율을 고려한 물의 양은 약 200만톤. 단순 계산하면 한 달 남짓에 고갈될 위기다. 강릉시는 상수원 하류 남대천에서 하루 1만톤을 저수지까지 끌어올리고, 연곡정수장의 3000톤과 인근 지자체 지원 물 1200톤도 운반급수하고 있다. 타 지자체에서도 지원의 손길이 이어지고 있다. △충남 보령 △원주 △서울 등에서 식수를 강릉에 보냈다. 정부는 관계부처 회의를 실시하고 현장지원반을 파견해 추가적인 지원대책을 마련한다는 계획이다. 다만 가뭄에 대해 재난사태를 선포한 선례가 없는데다 향후 얼마나 상황이 심각해질지, 언제쯤 해소될 수 있을지 불투명하다. 행안부 관계자는 ""산불처럼 주민들이 대피하는 상황이 아니기 때문에 현장에 맞춰 지원을 준비하고 있다""며 ""국가적 차원에서 인력, 물자를 총동원하겠다""고 말했다. 가장 좋은 해결책은 비가 내리는 것이지만, 강릉 지역은 당분간 강수 전망이 없다. 우진규 기상청 예보분석관은 ""올해 장마가 일찍 끝나 대체적으로 강수일수가 적은데다, 강원도 영동지방은 비구름이 태백산맥을 넘는 과정에서 비구름이 와해돼 가뭄이 심각해졌다""며 ""9월도 정확한 강수량은 예측이 불가능해 가뭄이 언제 나아질지 예측하기 어려운 상황""이라고 말했다."
태백,"전국에 비 와도 강릉은 예외…이유는? 입력 2025.09.01 수정 2025.09.01 읽어주기 기능은 크롬기반의 브라우저에서만 사용하실 수 있습니다. 가뭄이 이렇게 심각한 가장 큰 원인은 비가 적게 왔기 때문입니다. 내일까지 전국에 최대 100mm 이상의 비가 예보됐지만 이번에도 강원 영동 지역은 비가 찔끔 오는 수준에 그칠 전망입니다. 이세흠 가 전해드립니다. 이번 여름철 3개월 동안 강릉을 비롯한 강원 영동 지역에 내린 비는 232.5mm에 그칩니다. 평년 같은 기간의 3분의 1 수준으로, 1973년 이후 가장 적게 비가 내렸습니다. 지난 한 달만 따져보면 강수량이 60mm에 불과해 평년의 5분의 1 수준밖에 안 됩니다. 올여름 비가 특히 적었던 건 바람 방향과 지형 탓이 큽니다. 올여름 비구름과 수증기는 주로 서풍 계열의 바람을 타고 한반도로 들어왔는데, 태백산맥에 부딪히며 산맥 서쪽에는 비를 뿌리고, 동쪽으론 고온 건조한 바람만 넘어간 겁니다. 어제 전국 곳곳에 비가 내린 데 이어 내일까지 최대 100mm 이상의 많은 비가 예보됐지만, 이번에도 강원 영동의 강수량은 10mm가 채 안 될 거로 보입니다. 오는 수요일을 전후로 동풍 계열의 바람이 불 것으로 보이지만 비를 쏟아낼 정도는 아니라고 기상청은 밝혔습니다. 당분간 큰비 소식이 없는 만큼 강릉 지역의 가뭄은 장기화할 가능성이 있습니다. KBS 뉴스 이세흠입니다. :유현우/영상편집:이현모/그래픽:고석훈 가뭄이 이렇게 심각한 가장 큰 원인은 비가 적게 왔기 때문입니다. 내일까지 전국에 최대 100mm 이상의 비가 예보됐지만 이번에도 강원 영동 지역은 비가 찔끔 오는 수준에 그칠 전망입니다. 이세흠 가 전해드립니다. 이번 여름철 3개월 동안 강릉을 비롯한 강원 영동 지역에 내린 비는 232.5mm에 그칩니다. 평년 같은 기간의 3분의 1 수준으로, 1973년 이후 가장 적게 비가 내렸습니다. 지난 한 달만 따져보면 강수량이 60mm에 불과해 평년의 5분의 1 수준밖에 안 됩니다. 올여름 비가 특히 적었던 건 바람 방향과 지형 탓이 큽니다. 올여름 비구름과 수증기는 주로 서풍 계열의 바람을 타고 한반도로 들어왔는데, 태백산맥에 부딪히며 산맥 서쪽에는 비를 뿌리고, 동쪽으론 고온 건조한 바람만 넘어간 겁니다. 어제 전국 곳곳에 비가 내린 데 이어 내일까지 최대 100mm 이상의 많은 비가 예보됐지만, 이번에도 강원 영동의 강수량은 10mm가 채 안 될 거로 보입니다. 오는 수요일을 전후로 동풍 계열의 바람이 불 것으로 보이지만 비를 쏟아낼 정도는 아니라고 기상청은 밝혔습니다. 당분간 큰비 소식이 없는 만큼 강릉 지역의 가뭄은 장기화할 가능성이 있습니다. KBS 뉴스 이세흠입니다. :유현우/영상편집:이현모/그래픽:고석훈 ■ 제보하기 ▷ 카카오톡 : 'KBS제보' 검색, 채널 추가 ▷ 전화 : 02-781-1234, 4444 ▷ 이메일 : ▷ 유튜브, 네이버, 카카오에서도 KBS뉴스를 구독해주세요! 이 기사가 좋으셨다면 - 좋아요 0 - 응원해요 0 - 후속 원해요 0"
태백,"강릉 오봉저수지 저수율 14.5% 역대 최저 강원 지역에 비 소식이 전해진 가운데, 물 부족 사태를 겪고 있는 강릉의 예상 강수량은 5㎜ 안팎으로 극심한 가뭄을 해소하진 못할 것으로 보인다. 1일 기상청에 따르면, 전국 날씨는 대체로 흐리고 곳에 따라 2일까지 비가 이어질 전망이다. 이틀 누적 예상 강수량은 수도권 100㎜ 이상, 광주·전남과 부산·울산·경남 30~80㎜, 충청권 20~60㎜이다. 전북과 제주도는 10~60㎜, 대구·경북·울릉도·독도는 5~60㎜이다. 서울·인천·경기 서해안·경기 북부 내륙·제주도에는 오전 한때 호우주의보가 발령됐으며, 오후까지 시간당 20~30㎜의 매우 강한 비가 내리는 곳이 있겠다. 강원 북부내륙 중심으로는 최대 100㎜ 이상 비가 내릴 전망이다. 예상 강수량은 강원 내륙·산지 30~80㎜이다. 강릉 등 동해안의 경우 5㎜ 안팎의 약한 비가 내릴 것으로 보인다. 오봉저수지 저수율 15% 붕괴…'도암댐 활용론' 고개 농어촌공사에 따르면 이날 오전 강릉 지역 식수의 87%를 책임지는 오봉저수지 저수율은 전날 14.9%보다 줄어든 14.5%까지 떨어졌다. 평년에는 오봉저수지의 저수율이 70%를 웃돌았지만, 올여름은 가뭄의 영향으로 저수율이 식수 공급의 마지노선인 15% 이하로 떨어지며 역대 최저량을 기록하고 있다. 강릉의 올해 누적 강수량은 404.2㎜로, 평년의 42.5%에 그쳤다. 8월 한 달 강수량만 봐도 41.1㎜로 지난해 같은 기간과 비교해 절반에 미치지 못한다. 이처럼 강릉 지역에 비가 적었던 건 바람 방향과 지형 탓이 크다. 강릉이 속한 영동 지방은 동해 북부 해상에 자리한 고기압에서 동풍이 불 때 많은 비가 내리는데, 올여름에는 주로 서해상에서 발달한 비구름이 서풍을 타고 한반도에 유입됐다. 비구름과 수증기가 서풍 계열의 바람을 타고 불어온 뒤 태백산맥에 부딪히며 산맥 서쪽에는 비를 뿌리고, 동쪽으로는 고온 건조한 바람만 넘어간 것이다. 산악 지형 특성상 급경사로 인해 비가 와도 빗물이 저장되지 못하고 빠르게 동해로 흘러 나가게 되는 것도 이유다. 속초나 정선 등 인근 지역보다 강릉이 물 부족 사태를 겪고 있는 가장 큰 이유는 비가 내려도 대부분의 물을 오봉저수지 하나에 의존하고 있다는 것이다. 오봉저수지는 농업용 저수지로 작은 댐에 속하는데, 그동안 강릉 지역에 관광객이 증가하고 호텔, 골프장이 많이 들어서면서 물이 부족하게 된 것이다. 이에 오봉저수지 의존도를 낮추기 위해 강릉 인근에 있는 도암댐을 활용하는 방안을 적극 추진해야 한다는 목소리가 커지고 있다. 도암댐은 지난 1990년 강원도 평창군 도암면 송천에 건설된 유역변경식 수력발전 댐이다. 약 3000만 톤의 용수를 확보한 도암댐은 방류된 물이 강릉 남대천을 오염시킨다는 지적이 나와 2001년부터 방류가 중단된 바 있다. 0 0 기사 공유 댓글"
태백,"정부, 지난달 9일부터 현장지원반 비상근무 실시 중 강릉에 역대 최악의 물 부족 사태가 지속되며 18만 강릉 시민이 위기에 처했다. 올여름 비가 특히 내리지 않았던 탓에 강릉시 생활용수의 87%를 책임지는 오봉저수지가 고갈되고 있기 때문이다. 1일부터 수도 계량기를 75%까지 잠그는 제한급수 2단계가 본격화되며 긴장감이 고조되고 있다. 한국농어촌공사에 따르면 2일 오전 기준 오봉저수지의 저수율은 14.2%로, 역대 최저 수준의 저수율을 기록했다. 전날 오후 6시에 확인된 14.4%보다 0.2%p 더 떨어졌다. 강릉지역의 최근 6개월 강수량은 평년 대비 45.3%인 387.7mm다. 특히 이번 여름철은 1973년 이후 가장 적게 비가 내리면서 몇 주째 저수율 감소가 반복되는 추세다. 오봉저수지의 저수율은 한 달 사이 25%에서 20%로 떨어졌고, 불과 10여 일만에 15% 아래로 급락했다. 정부는 살수차·소방·군용 탱크 등 수백 대의 차량 등을 동원해 긴급 용수 공급에 나서고 있다. 2일에는 홍제정수장과 오봉저수지에 총 5071톤의 물을 지원했다. 홍제정수장은 오봉저수지의 물을 정수하는 시설이다. 또한 강릉 시내 지하 유출수 5000톤과 남대천 하천용수 7000톤 등 2만 톤의 대체용수도 공급됐다. 강릉시는 앞으로 살수차를 400대까지 늘려 하루 최대 1만5660톤을 추가로 확보한다는 계획을 내놨지만, 강릉 시민에게 닥친 물 부족 사태를 해결하기엔 역부족이다. 강릉에서 하루 소비되는 물의 양은 하루 9만 톤에 이르기 때문이다. 현재 오봉저수지 바닥은 거북이 등껍질처럼 쩍쩍 갈라졌고, 남은 물은 바닥을 드러낸 채 아슬아슬하게 유지되고 있다. 이달 내로 완전히 바닥을 보일 것이라는 예측도 나온다. 강릉 시민이 하루에 쓰는 생활용수가 워낙 많기에, 아무리 차량으로 물을 퍼 날라도 저수율을 1~2% 올리기 역부족인 상황. 6월 1일 62%였던 저수율이 갑자기 9월 1일 14%대로 급락한 이유는 무엇일까. 가장 큰 이유는 강수량 부족이다. 특히 7~8월 장마와 태풍 시기에 제대로 된 비가 내리지 않았다. 게다가 극심한 폭염 사태까지 겹치며 토양 수분 증발이 가속화됐다. 전문가들은 이러한 사태를 짧은 기간 안에 갑작스럽게 강도가 심해진 가뭄인 돌발가뭄으로 정의한다. 미국 국립해양대기청에 따르면, 돌발가뭄은 강수량 부족과 더불어 극심한 폭염이나 건조한 바람 등이 토양 수분을 급속히 증발시켜 5~8주 사이로 빠르게 진행되는 가뭄을 말한다. 기후학계에서는 돌발가뭄의 원인으로 지구온난화를 꼽는다. 지구의 평균 기온이 상승하면서 폭염 빈도와 강도를 증가시킨 것이다. 또한, 비의 분포가 극단화된 점도 돌발가뭄을 촉진하는 원인이 됐다. 어떤 지역엔 집중호우가 내리고, 다른 지역엔 무강수 지역이 장기화되는 이상 패턴이 돌발가뭄으로 이어진다는 것이다. 영국 매체 '더 타임스'에 따르면, 영국 또한 올해 돌발가뭄이 확대되기 전에 가장 건조한 봄을 보냈고, 6월에는 최악의 더위를 경험했다고 보고했다. 유럽 남부의 일부 지역은 올해 극심한 가뭄과 폭염으로 농업 생산과 물 수급에 치명적인 타격을 받아 가뭄을 '국가적 위기'로 선언하기도 했다. 기후변화로 인해 전 세계적으로 가뭄의 빈도가 증가하고 그 피해도 심각해지고 있는 것이다. 오봉저수지 저수율의 급격한 하락세 원인에는 강릉 지역 생활용수 87%를 오봉저수지 하나에 의존한다는 구조적인 한계도 있다. 관광객 유입으로 물 사용량이 더욱 늘어나는 여름 피서철이었던 점도 한몫했다. 또한, 전문가들은 7~8월이 농번기라 농업용수도 많이 사용돼 저수율 하락 속도가 더욱 빨라졌다고 보고 있다. 결국 해답은 대체 수원 확보다. 가뭄은 예측하기도 어렵고 피할 수 없기 때문에 물을 공급받는 수원을 다양화해야 한다. 인근 강이나 댐과 같은 광역상수도망과 연결하거나 해수 담수화 시설을 마련해 비상시 활용 가능한 수원을 확보하는 방법이 있다. 한국환경정책협의회는 강릉의 물 부족 사태를 해결하기 위해 도암댐을 적극 활용하자는 의견을 냈다. 도암댐은 태백산맥 너머 강릉수력발전소에 물을 보내기 위해 1991년 건설된 다목적 댐이다. 강릉에서 20km 남짓 떨어진 평창군 대관령면에 위치해 있어 접근성도 용이하다. 저수량이 3000만 톤에 이르러, 도양댐을 활용하면 강릉 시민 전체가 가정에서 1년 6개월 동안 물을 사용할 수 있을 것이라는 예측도 나왔다. 하지만 강릉 시민들은 도양댐을 활용하자는 주장에 우려를 표하고 있다. 대규모 고랭지 채소밭이나 축산단지, 리조트 등에서 오염된 물이 평창의 하천을 통해 도암댐에 모여든다는 것이다. 실제로 도암댐은 2001년 오폐수로 수질이 나빠져 가동이 중단된 이후 20년 넘게 방치되고 있는 상태다. '물그릇 신화'는 끝났다. 비어 있는 그릇을 채우면 된다는 단순한 논리에 갇히면 근본적인 해결책을 찾을 수 없다. 지금 필요한 것은 긴급 대책과 더불어 장기적인 수자원 관리 전략이다. 안정적인 물 공급을 위해 수원을 다변화하고, 수질 관리와 절수 정책까지 아우르는 종합적인 해법이 마련돼야 할 시점이다."
