region,text
태백,"‘재난사태급 가뭄’ 강릉에 당분간 큰비 없어…내일 5㎜ ‘찔끔’ “강릉 물 공급 오봉저수지 저수율, 4주 내 10% 아래로 하락 전망” ‘지하 암반수’ 대관령샘터 이용 부쩍 늘어…마실 물·요리 등 활용 “극한가뭄 3년 이상 이어지면 경험하지 못한 물 부족 발생” 역대급 가뭄에 기우제를 올리고, 먹을 물을 찾아 공병을 든 사람들이 대관령셈터에서 길게 줄을 늘어선다. 계량기 75%를 자율적으로 잠금 하는 강력한 제한 급수를 앞두고 있는 강릉 지역의 모습이다. 문제는 9월 첫날 전국 대부분 지역에 많은 비가 내리겠지만 정작 비가 필요한 강원 동해안에는 5㎜ 안팎의 적은 비만 올 것으로 예상됐다. 특히, 강원영동은 최소 9월 10일까지 비소식이 없다. 강원도 일대를 덮친 역대급 가뭄이 상당기간 심화될 수 있다는 것이다. 기우제 올렸지만 당분간 비 소식 없어…가뭄 심화할 듯 강원도 강릉 지역 주요 상수원인 오봉저수지 저수율이 역대 최저치를 갈아치우면서 강릉 시민들은 지난 23일 대관령에서 기우제를 지냈다. 계속되는 역대급 가뭄에 ‘굿’에라도 희망을 걸은 셈이다. 하지만 얄궂게도 9월 첫 날 전국에 많은 비가 예보돼 있지만, 정작 비가 필요한 강원 동해안에는 9월 1일 낮에 5㎜ 안팎의 비만 찔끔 내릴 전망이다. 다른 지역엔 제법 많은 비가 내리겠지만 비구름대가 태백산맥 서쪽에 많은 비를 뿌린 뒤 약화해 동쪽으로 넘어오면서 산맥 동쪽은 강수량이 적겠다. 통상 영동 쪽은 동해 북부 해상에 자리한 고기압에서 동풍이 불 때 많은 비가 내리는데 이런 모습이 나타나길 기대하기 어려운 상황이다. 기상청 최신 중기예보를 보면 강원영동에 최소 9월 10일까지 비 예보가 없다. 9월 5일 오후부터 6일까지 수도권과 강원영서에 비가 내리겠지만 강원영동 등 나머지 지역은 흐리기만 할 가능성이 높다. 기상청은 28일 발표한 기상가뭄 1개월 전망에서 10월 5일 기준으로도 강원영동 일부에 ‘보통’ 수준의 기상가뭄이 발생해 있을 것으로 내다봤다. 기상가뭄은 이전 6개월 누적강수량을 토대로 산출하는 ‘표준강수지수’가 -1 이하인 상태를 말한다. 지역별로 다르지만 일반적으로 강수량이 평년 대비 65% 이하면 표준강수지수가 -1 이하로 떨어진다. 강원영동은 올해 들어 이달 29일까지 내린 비가 477.5㎜로 예년 같은 기간 강수량의 절반에 못 미친다. 강릉은 누적 강수량이 404.2㎜로 평년의 40% 수준에 불과하다. 강릉시 물 공급 87%를 담당하는 오봉저수지 저수율은 현재 14.9%로 예년 이맘때 저수율 4분의 1 수준이다. 물 공급 하한선인 ‘사수위’까지 수위가 불과 8ｍ 정도만 남았다. 정부는 제한급수 등 대책이 시행됨에 따라 가변적이긴 하지만, 비가 내리지 않을 경우 4주 내 오봉저수지 저수율이 9.7%까지 떨어지며 10% 아래로 내려갈 것으로 예상한다. 강원 삼척시·정선군·태백시 등의 5만5000명에게 물을 공급하는 광동댐도 곧 가뭄에 들어설 전망이다. 정부는 27일 발표한 ‘주간 생활·공업용수 가뭄 현황 및 전망’에서 광동댐 가뭄단계가 ‘관심’에 들어선 뒤 곧 ‘주의’로 격상될 것으로 전망했다. 광동댐 유역엔 홍수기가 시작한 6월 21일부터 이달 27일까지 예년 같은 기간 강수량의 30% 수준인 166.0㎜ 비만 내렸다. “식수라도 절약” 공병 들고 총출동…계량기 75% 잠금 시행도 앞둬 한 달여간 최악의 가뭄이 계속되면서 온갖 페트병과 담금주병 등 공병을 싸 들고 대관령샘터로 모여들고 있는 이들도 늘고 있다. 롯데칠성음료에서 운영하는 대관령샘터는 대관령 지하 암반수를 취수해 수처리 과정을 거쳐 시민들에게 식수를 제공하고 있다. 이전부터 샘터는 지역민들에게는 식수원으로 이용됐으나 최근 극심한 가뭄 탓에 시민들의 발길이 더 잦아졌다. 연합뉴스에 따르면, 샘터를 찾은 시민들은 수도꼭지 3곳에 모두 자리를 잡고 공병에 물을 받느라 분주했다. 낮 한때는 여러 시민이 몰려 ‘대기’ 행렬이 이어지기도 했다. 초당동 주민 70대 박모씨는 연합뉴스에 “가뭄 이후로 방문 횟수가 부쩍 늘었다. 이렇게라도 최대한 물을 아껴보려고 한다”고 말했다. 박모씨는 담금주병과 약수물통, 김치통 등 용기 10여개에 물을 한가득 받아 갔다고 한다. 강릉지역 87%의 생활용수를 공급하는 상수원 오봉저수지의 저수율은 연일 최저치를 경신하고 있다. 31일 농촌용수종합정보시스템에 따르면 오봉저수지의 저수율은 이날 오전 7시 40분 기준 14.9%로 15% 선이 무너져 계량기 75%를 자율적으로 잠금 하는 강력한 제한 급수를 앞두고 있다. 앞서 시는 저수율이 25% 이하로 떨어진 지난 20일부터 아파트를 비롯해 5만3485가구의 계량기 50%를 잠금 하는 제한 급수로 절수 조치를 시행해 왔다. 저수지가 점점 메말라감에 따라 시는 전날부터 오봉저수지의 농업용수 공급도 중단했다. 이전까지는 ‘3일 공급·7일 제한’ 방식으로 농업용수를 공급, 원래대로라면 23∼29일 공급 제한 기간이 끝나고 30일부터 공급이 재개됐어야 하지만 저수율이 15% 가까이 떨어짐에 따라 농업용수를 공급하지 않기로 했다. 이에 정부는 전날 강릉에 재난 사태를 선포했다. 자연 재난으로는 처음이다. 오봉저수지를 둘러본 이재명 대통령은 장단기 대책을 종합적으로 검토해 실효성 있는 방안을 마련할 것을 지시했다. “극한가뭄 3년 이상 이어지면 경험하지 못한 물 부족 발생” 이런 가운데 ‘극한가뭄’ 발생 시 3년 차부터 피해가 기하급수로 늘어날 수 있다는 연구 결과도 나왔다. 가뭄이 3년간 계속될 경우 생활용수 부족에 따른 사회적 혼란 뿐만 아니라, 사회적으로 치뤄야할 비용도 수조원에 달한다는 것이다. 이상기후로 인한 최악의 시나리오가 현실화될 수 있다는 얘기다. 31일 환경부 등에 따르면 한국환경연구원은 최근 ‘극단적 홍수 및 가뭄 발생으로 인한 워터리스크의 전략적 대응방안 연구’ 보고서를 발표했다. 보고서에 따르면 ‘극한가뭄 발생 3년 차’부터 물 부족량이 급격히 늘었다. 연구진은 ‘과거 한강 유역 댐 저수량이 최저인 상황’과 ‘한강 유역 하천에 유입되는 물의 양이 최소인 상황’이 동시에 나타난 상황을 ‘극한가뭄’으로 정의했다. 연구진에 따르면 한강 유역 8개 댐 저수량이 최저였을 때는 1988년 7월 1일로 당시 저수량은 8개 댐 최대 저수량의 39%에 불과했다. 연간 하천 유출량이 최저였을 때는 ‘한강 권역 전체’를 기준으로는 2014년 7월 1일부터 2015년 6월 30일까지였다. 하천별로 북한강과 팔당댐 하류는 2014년, 남한강은 2015년에 연간 유출량이 가장 적었던 것으로 분석됐다. 표준유역별로는 2014년 유출량이 최저인 유역이 138개로 가장 많았고 2016년과 2015년이 뒤를 이었다. 연구진은 이런 정보를 조합해 A부터 C까지 3개의 극한가뭄 시나리오를 만들었다. 가장 극심한 가뭄 시나리오는 ‘C’로 한강 유역 댐 저수량이 최저인 상황에 표준유역별 하천 유출량 최저치를 반영한 시나리오다. 이는 댐에 저장된 물도, 각 유역 하천에 흐르는 물도 역대 가장 적은 상황을 의미한다. 가뭄에 따른 물 부족량을 구하기 위한 ‘수요량 계산’은 제1차 국가물관리기본계획에 계획 수립 이후 추진되기 시작한 경기 용인시 반도체 첨단산업단지 등의 수요를 반영해 이뤄졌다. 분석 결과 시나리오 C를 적용해도 가뭄 1년 차엔 물 부족 문제가 심하지 않았다. 구체적으로 한강 유역 시도 생활용수 부족량은 41만8000t, 농업용수 부족량은 1404만t, 공업용수는 부족하지 않을 것으로 분석됐다. 그러나 가뭄이 해를 넘어가면 물 부족량이 급격히 증가했다. 가뭄 2년 차 생활용수, 공업용수, 농업용수 부족량은 각각 6300만1000t, 7만458만7000t, 1억4908만6000t이었고 3년 차엔 4억7222만1000t, 4억5339만5000t, 1억6687만6000t이었다. 4∼6년 차 부족량은 3년 차와 비슷했다. 연구진은 “아무리 극단적인 가뭄이 발생해도 1년 차엔 생활·공업용수 부족량이 많지 않고, 2년 차까지도 심각한 문제는 없을 것으로 예측됐다”면서 “그러나 3년 차부터 물 부족량이 급격히 증가한다”고 설명했다. 연구진은 “3년 이상 가뭄이 발생하는 경우 지금까지 경험하지 못한 물 부족으로 인해 사회적으로 큰 혼란이 발생할 것”이라고 덧붙였다. 극한가뭄이 장기간 이어지면 ‘조 단위’ 피해가 발생할 것으로 분석됐다. 시나리오 C를 적용해 한강 유역 시도 가뭄 피해액을 산정한 결과 1년 차엔 78억원에 머물다가 2년 차에 1조5425억원, 3년 차에 9조2883억원으로 급증했다. 가뭄 6년 차 피해액은 9조3254억원으로 추산됐다. 연구진은 “우리나라에 6년 연속 극한가뭄이 발생하는 경우 서울 등 대도시 지역의 생활용수 부족량이 많지 않지만, 하천 상류 중·소규모 지역에서 물이 매우 부족하면서 경제적 피해도 크게 발생하는 것으로 나타났다”면서 “용인 첨단산단 등 때문에 물 수요량이 급증하면서 가뭄으로 인한 경제적 피해가 커졌다”고 설명했다."
태백,"당분간 ‘한여름’ 같은 무더위도 계속 9월의 첫날인 1일 전국 대부분 지역에 비가 내리겠지만 강원 강릉 등 영동지방에는 5㎜ 안팎의 ‘찔끔비’가 내릴 것으로 전망된다. 기상청 중기예보에 따르면 오는 10일까지 영동지방에 별다른 비 소식은 없다. 서쪽에서 발달한 비구름대가 많은 비를 뿌린 뒤 태백산맥을 만나 소멸하거나 약화하는 것이 ‘강릉 가뭄’의 원인으로 지목된다. 31일 기상청에 따르면 강원 강릉에 올해 누적 강수량은 404.2㎜로, 평년의 42.5%에 그친다. 8월 한 달 강수량만 봐도 41.1㎜로 지난해 같은 기간과 비교해 절반에 미치지 못한다. 31일 강원 강릉시 대관령샘터에서 시민들이 식수로 사용할 물을 받고 있다. 롯데칠성음료에서 운영하는 대관령샘터는 대관령 지하 암반수를 취수해 수처리 과정을 거쳐 시민에게 식수를 제공하고 있다. 2025.8.31. 연합뉴스 이 지역에 적은 비가 내린 건 영동지방 서쪽에 있는 태백산맥 때문이다. 서풍을 타고 오는 비구름대가 이 산맥을 넘지 못하고 약화되기 때문이다. 우진규 기상청 통보관은 정례 예보 브리핑에서 “국지적으로 발달한 비구름대가 서풍을 따라 영동지방으로 진입할 때 태백산맥을 넘기 어렵다”고 설명했다. 비구름대가 태백산맥에 부딪혀 소멸하는 경우가 많고 설령 넘더라도 수증기량이 크게 줄어든다는 것이다. 영동지방은 동해 북부 해상에 자리한 고기압에서 동풍이 불 때 많은 비가 내리는데, 올여름엔 주로 서해상에서 발달한 비구름이 서풍을 타고 우리나라에 유입됐다. 김백민 부경대 환경대기과학과 교수는 “강원 지역 가뭄 피해는 최근 10년간 이어져 온 현상”이라고 말했다. 2일까지 전국 곳곳에 비가 내리겠지만 강릉의 예상 강수량은 5㎜ 안팎이다. 영동지방을 제외하면 2일까지 수도권·충청·강원·부산·울산·경남은 30~80㎜, 제주는 20~80㎜, 광주·전남·전북은 10~60㎜의 비가 오겠다. 수도권과 강원 영서에는 5일과 6일에도 비가 올 것으로 예보됐다. 다만 비가 온다고 해도 더위가 가시지는 않겠다. 1일 아침 최저기온은 23~27도, 낮 최고기온은 28~34도로 예보됐다. 2일도 낮 최고기온은 33도까지 오르겠다. 31일 강원 강릉시 주요 상수원인 오봉저수지 상류에서 한 관계자가 굴착기로 물길을 내고 있다. 2025.8.31. 뉴스1 9월의 첫날인 1일 전국 대부분 지역에 비가 내리겠지만 강원 강릉 등 영동지방에는 5㎜ 안팎의 ‘찔끔비’가 내릴 것으로 전망된다. 기상청 중기예보에 따르면 오는 10일까지 영동지방에 별다른 비 소식은 없다. 서쪽에서 발달한 비구름대가 많은 비를 뿌린 뒤 태백산맥을 만나 소멸하거나 약화하는 것이 ‘강릉 가뭄’의 원인으로 지목된다. 31일 기상청에 따르면 강원 강릉에 올해 누적 강수량은 404.2㎜로, 평년의 42.5%에 그친다. 8월 한 달 강수량만 봐도 41.1㎜로 지난해 같은 기간과 비교해 절반에 미치지 못한다. 이 지역에 적은 비가 내린 건 영동지방 서쪽에 있는 태백산맥 때문이다. 서풍을 타고 오는 비구름대가 이 산맥을 넘지 못하고 약화되기 때문이다. 우진규 기상청 통보관은 정례 예보 브리핑에서 “국지적으로 발달한 비구름대가 서풍을 따라 영동지방으로 진입할 때 태백산맥을 넘기 어렵다”고 설명했다. 비구름대가 태백산맥에 부딪혀 소멸하는 경우가 많고 설령 넘더라도 수증기량이 크게 줄어든다는 것이다. 영동지방은 동해 북부 해상에 자리한 고기압에서 동풍이 불 때 많은 비가 내리는데, 올여름엔 주로 서해상에서 발달한 비구름이 서풍을 타고 우리나라에 유입됐다. 김백민 부경대 환경대기과학과 교수는 “강원 지역 가뭄 피해는 최근 10년간 이어져 온 현상”이라고 말했다. 2일까지 전국 곳곳에 비가 내리겠지만 강릉의 예상 강수량은 5㎜ 안팎이다. 영동지방을 제외하면 2일까지 수도권·충청·강원·부산·울산·경남은 30~80㎜, 제주는 20~80㎜, 광주·전남·전북은 10~60㎜의 비가 오겠다. 수도권과 강원 영서에는 5일과 6일에도 비가 올 것으로 예보됐다. 다만 비가 온다고 해도 더위가 가시지는 않겠다. 1일 아침 최저기온은 23~27도, 낮 최고기온은 28~34도로 예보됐다. 2일도 낮 최고기온은 33도까지 오르겠다. Copyright ⓒ 서울신문 All rights reserved. 무단 전재-"
태백,"<앵커> 새벽부터 전국 곳곳에 비가 내렸습니다만, 그 어느 곳보다 비가 절실한 강릉 지역은 비구름마저 비껴갔습니다. 적은 강수와 폭염으로 극심한 가뭄까지 겪게 된 올여름은, 역대 가장 더웠던 여름으로 기록될 전망입니다. 의 보도입니다. <기자> 수도권을 중심으로 오늘 새벽부터 50mm 안팎의 비가 내렸습니다. 강릉에도 5mm 미만의 적은 비가 내릴 거란 예보가 있었지만, 그마저도 제대로 내리지 않았습니다. 저기압이 강하게 발달하지 못한 데다, 대기 하층의 수증기가 태백산맥에 가로막혀 동쪽으로 넘어가지 못한 탓입니다. 실제 대기 하층과 지상 부근의 수증기량을 알 수 있는 이슬점 온도를 살펴보니, 수증기량이 적을수록 수증기가 응결하는 이슬점 온도가 낮은데 서쪽에 비해, 영동 지역의 수치가 낮았습니다. 이번 여름 강릉에 내린 비는 187.9mm, 평년 강수의 30%에도 미치지 못했는데, 긴 폭염으로 증발량은 578.4mm에 달했습니다. 바람이 산맥을 넘으며 고온 건조해지는 '푄 현상'에 강원 동해안 지역은 더욱 메말랐습니다. 현재 예보 상 강원 동해안에는 오는 11일까지 비 소식이 없습니다. 그 밖의 다른 지역의 경우 충남은 많은 곳 80mm 이상, 수도권에는 10에서 60mm 등 내일 오전까지 비가 더 내리겠습니다. 비가 그치면 기온이 다시 오르고 체감 온도도 33도를 웃돌겠습니다. 지난 6월부터 8월까지 우리나라 평균 기온은 25.7도로 역대 가장 더웠던 지난해 여름을 경신해, 올해가 가장 더운 여름으로 기록될 전망입니다."
태백,"강수일 6일 줄고 가뭄 11일 늘고 최근 30년 대비 지난 10년 비교 여름·겨울철 강수 감소 뚜렷 올 여름 강릉에서 역대 최악 가뭄이 나타나고 있는 가운데 기상가뭄 발생일이 증가, 기후위기 차원에서 가뭄에 대비해야 한다는 지적이 나온다. 31일 본지가 기상청 자료를 분석한 결과, 최근 10년 간 강릉의 연평균 강수일수는 105.9일로 나타났다. 최근 30년 연평균 강수일수가 112.5일인 것과 비교하면 6.6일 줄었다. 사계절 모두 강수일수가 줄어든 가운데 여름과 겨울의 강수일수가 특히 많이 줄었다. 올해 봄·여름을 포함해 집계한 결과, 30년 대비 지난 10여년 간 강수일수는 봄 1.9일, 여름 4.4일, 가을 0.4일, 겨울 3.8일 감소했다. 반면 기상가뭄 발생일수는 증가했다. 기상학적 가뭄은 최근 6개월간 누적 강수량이 과거 평균보다 적고 건조한 상태가 지속되는 현상이다. 기상청 자료를 보면 강원 영동 지역의 최근 10년 간 기상가뭄 연평균 발생일수는 58.4일로 집계됐다. 이는 지난 30년간 발생일수 47.3일보다 11.1일, 지난 50여년간 발생일수 41.3일보다 17.1일 늘어난 수치다. 강원 영동의 가뭄은 올해만의 일이 아니다. ‘역대급 더위’가 장기화된 지난해에도 강원 영동은 25.6일의 기상가뭄이 발생했다. 지난해 강릉과 속초에서는 8월 15일 기상가뭄이 발생해 약 한 달 동안 지속됐다. 지난해 전국 평균 기상가뭄 발생일수가 3.3일로 1993년 이후 가장 적었던 것과 대비된다. ‘기후위기의 조용한 재앙’으로 여겨지는 가뭄은 전국적으로도 증가세다. 지난 10년간 전국의 연평균 기상가뭄 발생일수는 74.6일로 50여 년 49.7일과 비교해 24.9일 늘었다. 강원 지역으로 좁혀봐도 지난 10년 연평균 발생일수는 72.7일로 50여년 44.3일보다 28.4일 늘었다. 28일 기준 가뭄지수 SPI6를 기준으로 현재 강릉은 ‘극한 가뭄’, 속초·태백은 ‘심한 가뭄’ 상태다. 정덕교 고랭지채소연합회 강원도연합회장은 “살다살다 올해 같은 가뭄은 처음본다”며 “배추 작황이 좋지 않아 걱정이 크다”고 전했다. 박수진 한국기후변화연구원 기후정책연구실장은 “최근 폭염이 늘면서 강수패턴도 장마전선에 의한 비가 아닌 좁은 지역에 집중적으로 쏟아지는 대류형 강수로 바뀌고 있다”며 “물 저장량을 늘리는 등 지자체는 수자원에 대한 접근을 달리해야 한다”고 했다."
태백,"1일 수도권을 중심으로 전국 곳곳에 강한 비가 내렸지만 극심한 가뭄을 겪고 있는 강원 강릉에는 2일까지 5㎜ 적은 비가 내릴 것으로 예보됐다. 강릉에는 이달 10일까지도 비 소식이 없는데다, 폭염으로 물이 증발하는 속도가 빠른 돌발가뭄 현상까지 겹쳐 피해가 더 커질 것으로 보인다. 1일 기상청이 낸 중기 전망을 보면 강원 영동 지역에는 오는 10일까지 비 예보가 없다. 5일부터 수도권과 강원 영서 등 중부지방에는 비가 내리겠지만 강원 영동 지역에는 비가 내리지 않을 가능성이 높다. 올해 강릉에 닥친 가뭄의 주요 원인은 평년보다 적게 내린 비에 있다. 올들어 강릉지역에 내린 비의 양은 404.2㎜로 평년의 40% 수준에 그친다. 특히 여름철 강수량은 187.9㎜로 여름 강수량으론 1917년에 이어 두 번째로 적다. 비구름이 티베트고기압과 북태평양고기압이 겹쳐 만든 이중고기압을 뚫지 못하고, 비구름이 만들어 지더라도 태백산맥을 넘지 못해 올해 영동 지역 강수량은 평년을 크게 밑돌았다. 여기에 바다에서 불어온 축축한 바람이 태백산맥을 넘으며 건조한 열풍으로 바뀌는 ‘푄 현상’도 이번 가뭄의 주요 원인 중 하나다. 정지훈 교수는 “보통 태풍이 동해안 쪽으로 빗겨 나가면 강릉, 영동 지역에 비가 많이 오는데 올해는 그런 매커니즘이 한번도 없었다”며 “장기간 가물었던 지역에 푄 현상 등 여러 요인이 맞물려 발생한 이례적인 가뭄”이라고 설명했다. 이번 강릉 가뭄에서는 ‘돌발가뭄’ 특성도 확인된다. 돌발가뭄은 폭염 등 기온 상승으로 빠르게 저수가 증발하면서 2~3주만에 나타나는 가뭄을 뜻한다. 강릉 지역 식수원인 오봉저수지의 평년대비 저수율은 지난 6월 29일 66%에서 7월 14일 40%로 떨어졌다. 불과 2주만에 저수율이 20%포인트 넘게 감소한 것이다. 에너지·기후정책 연구단체 넥스트의 분석을 보면, 지난 7월 강릉시 강수량 대비 증발량은 155.6%로 평년 7월의 3배에 달한다. 정해수 넥스트 연구원은 “봄철만 놓고 보면 수자원이 평년보다 적지 않았지만 여름철 짧은 장마와 극한 폭염 영향으로 급속도로 물이 고갈됐다”며 “올해는 강릉에 피해가 집중됐지만 온난화로 인한 여름 돌발가뭄이 뉴노멀이 된 만큼 내년에는 또 다른 가뭄 피해지역이 생길 수 있다”고 말했다."
