region,text
고성,"국민의힘 장동혁 대표. 국민의힘 장동혁 대표가 9일 사상 최악의 가뭄이 이어지고 있는 강원 강릉을 찾아 심각한 피해 현장을 점검하고 지역의 어려움을 경청한다. 국민의힘 강원도당에 따르면 이번 현장 방문에는 장 대표를 비롯해 강릉이 지역구인 권성동 의원, 김도읍 정책위의장, 정희용 사무총장, 유상범 원내수석부대표 등이 동행한다. 이와 함께 이철규 도당위원장과 이양수 의원 등 동해안을 지역구로 둔 의원들과 김진태 강원도지사도 함께 한다. 국민의힘 권성동 의원. 이들은 우선 강릉시청을 방문해 김홍규 시장 등으로부터 가뭄대응 현황을 보고 받을 계획이다. 이어 홍제정수장으로 이동해 급수지원 상황 점검과 함께 최일선에서 헌신하고 있는 소방관 등을 격관계자들을 격려할 예정이다. 국민의힘은 이번 방문을 계기로 가뭄 극복을 위한 특별 대책 마련에 박차를 가하고, 주민 생활 안정과 지역경제 회복을 위한 실질적 지원 방안을 적극 검토한다는 계획이다. 국민의힘 지도부의 강릉 방문은 재난 사태 선포 이후 10일 만이다. 앞서 지난 달 26일 더불어민주당 정청래 대표를 시작으로 이재명 대통령과 김민석 국무총리 등이 강릉을 방문해 가뭄 상황 등을 점검했다. 강릉지역은 지난 달 30일 재산사태가 선포됐으며 지난 7일에는 2차 국가소방동원령이 발령됐다."
고성,"’정당 해산’ 거론하자…국민의힘, 연설 내내 맞불 ’내란 청산’ 주장엔 ""대통령 다 됐다""…전과 언급도 본회의장 지켰지만…수위 높은 발언에 ’고성’도 ’내란 청산’ 주장엔 ""대통령 다 됐다""…전과 언급도 본회의장 지켰지만…수위 높은 발언에 ’고성’도 AD 악수의 온기가 식기도 전에 민주당 정청래 대표가 내란을 고리로 또다시 정당 해산을 언급하자, 국민의힘에선 강한 반발이 터져 나왔습니다. 제1야당을 향한 선전포고나 다름없다며, 정 대표를 '여의도 대통령'에 비유해 비꼬기도 했습니다. 가 보도합니다. '정당 해산'까지 거론한 정청래 대표 연설에 국민의힘은 차진 추임새로 맞섰습니다. 반복되는 '내란 청산 구호'는 대통령이 다 된 거 같다고 비꼬았고, 과거를 회피하지 말라는 공격에는 정청래 대표의 '전과기록'을 꺼내 들며 역공에 나섰습니다. "" 미국 대사관저는 누가 갔어!"" 본회의장을 떠나진 않았지만, 국민의힘은 사이사이 큰 소리로 받아치며 불쾌함을 감추지 않았습니다. "" 정말 아무 말 대잔치다."" 전날 정청래 대표와 직접 손을 맞잡았던 장동혁 대표는 거대 여당 대표의 품격을 기대했지만 너무 실망했다면서, 자화자찬 명비어천가였다고 혹평했습니다. 대통령까지 나서 여당의 양보를 언급했건만, 돌아온 건 야당을 향한 선전포고였다고 쏘아붙였습니다. 협치의 물꼬를 틔웠다고 평가받던 회담이 끝난 지 하루도 안 돼 정국이 차갑게 얼어붙은 모양새인데, 야당은 대응 수위를 고심하고 있습니다. 당장 교섭단체 대표연설을 앞둔 송언석 원내대표는 대화의 장을 걷어찬 채 독주하는 민주당을 강하게 비판하고, 이재명 정부의 실정도 충분히 짚겠다고 벼르고 있습니다. 국민의힘은 '대여 투쟁'과 별개로 지도부가 극심한 가뭄을 겪는 강릉 지역에 방문하는 등, 민생을 챙기는 '투트랙 전략'에도 나섰습니다. 야당은 대통령이 회담에서 약속한 '속도 조절'이 실제로 관철되는지 우선 더 지켜보겠다는 입장입니다. 목요일, 대통령의 취임 100일 회견에서 야당에 대해 어떤 메시지가 나오느냐 역시 향후 정국의 분수령이 될 거란 분석이 나옵니다. YTN 김철희입니다. : 이상은 이승창 영상편집 : 연진영 YTN 김철희 ※ '당신의 제보가 뉴스가 됩니다' YTN 검색해 채널 추가 02-398-8585 악수의 온기가 식기도 전에 민주당 정청래 대표가 내란을 고리로 또다시 정당 해산을 언급하자, 국민의힘에선 강한 반발이 터져 나왔습니다. 제1야당을 향한 선전포고나 다름없다며, 정 대표를 '여의도 대통령'에 비유해 비꼬기도 했습니다. 가 보도합니다. '정당 해산'까지 거론한 정청래 대표 연설에 국민의힘은 차진 추임새로 맞섰습니다. 반복되는 '내란 청산 구호'는 대통령이 다 된 거 같다고 비꼬았고, 과거를 회피하지 말라는 공격에는 정청래 대표의 '전과기록'을 꺼내 들며 역공에 나섰습니다. "" 미국 대사관저는 누가 갔어!"" 본회의장을 떠나진 않았지만, 국민의힘은 사이사이 큰 소리로 받아치며 불쾌함을 감추지 않았습니다. "" 정말 아무 말 대잔치다."" 전날 정청래 대표와 직접 손을 맞잡았던 장동혁 대표는 거대 여당 대표의 품격을 기대했지만 너무 실망했다면서, 자화자찬 명비어천가였다고 혹평했습니다. 대통령까지 나서 여당의 양보를 언급했건만, 돌아온 건 야당을 향한 선전포고였다고 쏘아붙였습니다. 협치의 물꼬를 틔웠다고 평가받던 회담이 끝난 지 하루도 안 돼 정국이 차갑게 얼어붙은 모양새인데, 야당은 대응 수위를 고심하고 있습니다. 당장 교섭단체 대표연설을 앞둔 송언석 원내대표는 대화의 장을 걷어찬 채 독주하는 민주당을 강하게 비판하고, 이재명 정부의 실정도 충분히 짚겠다고 벼르고 있습니다. 국민의힘은 '대여 투쟁'과 별개로 지도부가 극심한 가뭄을 겪는 강릉 지역에 방문하는 등, 민생을 챙기는 '투트랙 전략'에도 나섰습니다. 야당은 대통령이 회담에서 약속한 '속도 조절'이 실제로 관철되는지 우선 더 지켜보겠다는 입장입니다. 목요일, 대통령의 취임 100일 회견에서 야당에 대해 어떤 메시지가 나오느냐 역시 향후 정국의 분수령이 될 거란 분석이 나옵니다. YTN 김철희입니다. : 이상은 이승창 영상편집 : 연진영 YTN 김철희 ※ '당신의 제보가 뉴스가 됩니다' YTN 검색해 채널 추가 02-398-8585"
고성,"장동혁 국민의힘 대표가 9일 극심한 가뭄을 겪고 있는 강릉시를 찾아 가뭄 대응 상황을 점검했다. 장 대표는 이날 김도읍 정책위의장, 정희용 사무총장, 유상범 원내수석부대표 등 중앙당 지도부를 비롯해 이철규 도당위원장, 권성동·한기호·박정하·이양수 국회의원과 함께 강릉을 찾아 가뭄 극복 성금 1억원을 전달하고, 가뭄대응 현장 간담회를 가졌다. 김진태 지사, 김시성 도의장, 김혜란 춘천갑당협위원장, 김홍규 강릉시장, 최익순 강릉시의장 등도 함께했다. 장동혁 대표는 “유례없는 가뭄으로 큰 고통을 받고 있어서 마음이 무겁다”며 “가뭄을 해결할 수 있는 보다 근본적인 대책 마련이 필요하며, 조정과 협조가 필요한 부분은 국민의힘에서도 적극 나서겠다”고 약속했다. 김진태 지사는 “대표님의 첫 민생 행보이자 첫 지방 일정으로 강릉을 방문해주셔서 감사드린다”며 “이번 방문이 고생이 많은 김홍규 시장을 비롯한 시청 직원들과 고통을 겪고 있는 강릉시민들께 큰 응원이 되길 바란다”고 했다. 이철규 위원장은 “25만명의 도당 당원들은 강릉시민들과 함께할 것”이라며 “도암댐 원수 사용에 대해 지자체별로 다양한 의견이 있는 만큼 지역주민들을 설득하는 데 노력하겠다”고 말했다. 이날 간담회에서는 도암댐 활용방안 등 가뭄을 해결할 수 있는 여러 방안들이 논의됐다. 장 대표는 “당 차원에서 예산 지원 등에 적극 협조하기로 했다”며 “먹는 물에 대해 지자체별로 관리하다 보니 예산이 부족하거나 중복되는 경우가 있다. 국가에서 국민들의 먹는 물에 대해 종합적이고 체계적인 대책을 마련하고 관리해야 한다”고 주문했다. 이어 그는 “ 국가적 차원의 관리가 필요하고, 지역 간 이해관계가 갈리는 문제야말로 여야정 협의체에서 해결돼야 할 좋은 주제라고 생각한다”고 강조했다. 이들은 이어 홍제정수장을 방문해 운반급수 현황을 점검하고, 급수 작업에 나서고 있는 소방대원들을 격려했다. 장동혁 대표는 “강릉시민들께서 소방공무원과 군인 여러분을 응원하는 현수막을 붙여 놓으셨다”며 “강릉시민만이 아닌 국민 모두의 마음이라고 생각한다. 이 위기가 빨리 극복될 수 있도록 국민의힘에서도 최선을 다하겠다”고 약속했다."
고성,"오는 11일 취임 100일을 맞이하는 이재명 대통령이 강원권 타운홀미팅을 긍정적으로 검토하고 있는 것으로 알려졌다. 일본·미국 순방 직후 강릉 가뭄 현장을 둘러본 이 대통령의 '강원행'이 또 한번 임박했다는 관측이 나오면서 강원 현안들이 집중 논의될지 관심이 쏠린다. 정치권에 따르면 이 대통령은 권역별 소통행사인 타운홀미팅 차기 장소로 강원도를 유력 검토하고 있는 것으로 전해졌다. 일본·미국 순방으로 잠시 중단됐던 타운홀미팅을 강원에서 재개할 가능성이 높아진 것이다. 취임 100일동안 내각 구성이 어느 정도 마무리되고, 국정과제 수립이 이뤄진 상황에서 이 대통령이 직접 강원지역 주민들과 소통해 어떤 메시지를 내놓을지가 최대 관심사다. 가장 먼저 이 대통령이 대선 당시 내놓았던 공약이 재조명되고 있다. 이 대통령은 강원지역에 'K-문화관광벨트'를 조성하겠다면서 2018평창동계올림픽 유산을 활용한 케이팝·스포츠·자연 융합형 체험 관광지 및 복합 해양레저 관광지 구축 의지를 밝혔었다. DMZ 생태·관광·평화 콘텐츠를 발굴해 평화관광 특구를 만드는 한편 정선, 영월, 태백은 자연을 즐기는 힐링 명소로 개발하겠다고 약속했다. 이같은 내용은 최근 국정기획위원회가 발표한 강원지역 국정과제에 반영돼 있는 상태다. 국정기획위는 ""전 세계가 주목하는 15조원 규모의 국내 관광시장에 대응해 강원을 '대한민국 방문 필수코스로 육성한다""고 밝혔었다. 이와 연결된 관광인프라 조성 및 SOC 확대도 이날 타운홀 미팅의 의제로 올라올 수 있다. 접경지역의 경우 군사시설에 따른 과도한 규제 완화, 주민 생활과 직결된 대북 정책도 논의될 가능성이 높다. 이 대통령은 지난달 미국 순방 당시 트럼프 대통령에게 김정은 북한 국무위원장과의 만남을 권하면서 ""전 세계 유일의 분단 국가인 한반도의 평화도 만들어 달라""고 요청했다. 북미정상회담을 통해 얼어붙은 남북 관계를 풀어 나가겠다는 구상으로 읽힌다. 트럼프 대통령 역시 2018평창동계올림픽을 언급하며 긍정적으로 화답했다. 현재 정부는 북한에 대한 개별관광도 추진하고 있어 금강산 관광 재개를 열망하는 고성주민들의 기대감도 높아지고 있는 상황이다. 폐광지역의 대체산업을 비롯해 지역 소멸 문제 등도 빼놓을 수 없는 의제이다. 도내 정치권 관계자는 ""대통령이 직접 지역의 현안을 듣고, 중요성을 판단해 국가적 차원에서 관련 대응책을 마련할 수 있는 중요한 기회가 되지 않겠느냐""고 말했다."
고성,"'가뭄 재난' 조치 필요 저수지 전국 660개소 달해 국민의힘 지도부, 강릉 찾아 현장 점검 정희용 ""정부 용수 확보 대책 마련해야"" 정희용 국회 농림축산식품해양수산위원회 국민의힘 간사가 지난달 24일 서울 여의도 국회 의원회관에서 열린 '한미 관세협상, 농축산물 시장개방 확대 검토 관련 농민단체 초청 긴급간담회'에서 발언을 하고 있다. 2025.07.24. 가뭄으로 인한 재난 조치가 필요한 농업 저수지가 전국 660개소에 달하는 것으로 나타났다. 국민의힘은 9일 가뭄 피해를 겪는 강원 강릉시를 찾아 현장을 점검하고 지원 대책을 모색했다. 국회 농림축산식품해양수산위원회 간사인 정희용 국민의힘 사무총장이 이날 농어촌공사로부터 제출받은 '전국 저수지별 저수율 현황'에 따르면, 전국 농업용 저수지 3424개소 중 평년 대비 저수율이 70% 이하로 가뭄 재난 조치가 필요한 저수지는 총 660개소인 것으로 파악됐다. 농어촌공사는 평년 대비 저수율이 기준치에 미달할 경우 '관심' '주의' '경계' '심각' 총 4가지 현장 조치 단계를 구분해 필요한 가뭄 재난 조치를 수행하도록 규정하고 있다. 관개기인 4월부터 9월까지 저수지 평균 저수율이 평년 대비 70% 이하일 때 '관심' 단계, 60% 이하는 '주의' 단계, 50% 이하는 '경계' 단계, 40% 이하는 '심각' 단계로 정해 용수 확보 대책을 실시하도록 했다. 저수율이 평년 대비 50% 이하로 떨어지는 '경계' 단계의 경우 가뭄 대책 상황실 운영 및 비상근무를 강화해야 하고, 평년 대비 40% 이하인 '심각' 단계에는 전사적 총력 체제로 대응하도록 정하고 있다. 지난 1일 기준 전국 저수지 현황에 따르면 ▲'심각' 단계 저수지는 98개소 ▲'경계' 단계 저수지는 72개소 ▲'주의' 단계 저수지는 175개소 ▲'관심' 단계 저수지는 315개소인 것으로 나타났다. 저수율이 0%인 저수지도 34개에 달하는 것으로 확인됐다. 지역별로 살펴보면, '심각' 단계 저수지는 수도권 지역에 분포해 있었으며, '경계' 단계 저수지는 강원 지역 등이었다. '주의' 단계 저수지는 충북과 강원 등지였으며, '관심' 단계 저수지는 전북과 충남, 대전 일대인 것으로 나타났다. 저수율이 0%인 지역은 경기 의왕, 시흥, 오산, 과천, 여주, 이천 등 수도권 남부로 조사됐다. 정희용 사무총장은 ""기후 위기 등으로 인해 강릉 지역뿐 아니라 전국 어디서나 가뭄 피해가 발생할 우려가 크다""며 ""정부는 피해가 간이 양수장 설치를 비롯한 저수지 물 채우기와 직접 급수, 지하수 임시 관정 설치 등 용수 확보 대책을 시급히 마련해야 한다""고 촉구했다. 장동혁 국민의힘 대표가 9일 오후 강원 강릉시 홍제정수장을 찾아 가뭄 대응 운반급수 현장점검을 하고 있다. 2025.09.09. ◎공감언론 뉴시스 Copyright © NEWSIS.COM, 무단 전재 및"
고성,"“예약 고객들, 다짜고짜 화내고 직원 이름 물어” 오봉저수지 저수율 12.2%…13일 강수 확률↑ 비 소식 간절한 강릉 오봉저수지 9일 강원 강릉시 오봉저수지가 바짝 말라붙어 바닥을 드러내고 있다. 최악의 가뭄 사태를 맞고 있는 강릉지역의 생활용수 87%를 공급하는 오봉저수지의 저수율은 이날 오전 6시 기준 12.3%로 전날보다 0.1%포인트 떨어졌다. 2025.9.9 연합뉴스 극심한 가뭄으로 재난상태가 선포된 강원 강릉시의 한 호텔 직원이 계속되는 문의와 민원 전화로 인한 고충을 털어놓았다. 지난 8일 한 온라인 커뮤니티에는 “강릉 호텔에서 일하는 사람입니다. 간곡히 부탁드립니다”라는 제목의 글이 올라와 화제가 됐다. 자신을 강릉 경포호 인근 호텔 직원이라고 밝힌 A씨는 “요즘 강릉 가뭄으로 여행 예정이셨던 분들이 여행이 잘못될까 하는 걱정으로 문의가 참 많다”면서 운을 뗐다. A씨는 “불안한 마음으로 전화주시는 것 알고 응대를 하고 있다”면서도 “화는 좀 내지 말아 달라. 진짜 간곡히 부탁드린다”고 호소했다. A씨에 따르면 호텔에 오는 전화의 4분의 3이 가뭄 관련 문의이며, 전화를 받자마자 고성이 다짜고짜 쏟아지는 경우도 부지기수다. A씨는 “호텔이 비를 쫓아낸 게 아니다. 직원들도 언제 물이 나올지 모른다”면서, 심지어 “ 15일 뒤에 체크인하는데 물이 안 나오냐 묻는데, 그걸 일개 강릉 시민이 어떻게 알겠나”고 토로했다. 최악 가뭄 강릉의 제한급수 필수품 9일 최악 가뭄으로 강원 강릉지역에 단수 사태가 속출하는 가운데 시내 한 생활용품점이 제한급수 필수품을 모아 놓고 팔고 있어 눈길을 끌고 있다. 2025.9.9 연합뉴스 언제 물이 나올지 모른다고 답하면 고객이 화를 내고 직원과 책임자의 이름을 캐묻는다는 게 A씨의 하소연이다. A씨는 “미래에 물이 나올지 말지를 예측 못 한다고 화낼 일은 아니다”라며 “책임지라고 하려고 이름을 묻는 거냐”라고 반문했다. 이어 “강릉 시민 한명이 주변 식당과 시장, 관광명소가 보름 뒤 영업을 하는지 안 하는지 어떻게 다 파악하나”라며 “제발 상식과 예의를 갖춰달라. 호텔 직원은 가해자도, 예언가도 아니다”라고 목소리를 높였다. 강릉에서는 지난 6일 오전 9시부터 아파트 113곳과 대형숙박업소 10곳 등의 수도 공급이 중단됐다. 이는 해당 구역 전체 9만 1750세대의 약 49%에 해당한다. 온라인 커뮤니티에는 “제발 강릉에 놀러와서 물 펑펑 쓰지 말아달라”고 호소하는 강릉 시민들의 글이 잇따르고 있다. 그럼에도 상당수의 숙박업소들이 가뭄으로 인해 예약을 취소하려는 여행객들에게 취소 수수료를 부과하고 있어, ‘울며 겨자먹기’로 강릉을 찾는 여행객들이 있는 것으로 알려졌다. 또 강릉의 한 유명 호텔은 비상사태가 선포된 바로 다음날 홈쇼핑을 통해 숙박 상품을 판매해 빈축을 사기도 했다. 강릉 지역 생활용수의 87%를 공급하는 오봉저수지의 저수율은 이날 오전 10시 기준 12.2%로 전날보다 0.2%포인트 떨어졌다. 극심한 가뭄이 이어지는 가운데 오는 13일 한반도를 지나는 저기압의 영향으로 강릉을 포함한 영동 지역에 비가 올 확률이 오전 80%, 오후 70%로 예상된다. 극심한 가뭄으로 재난사태가 선포된 강원 강릉시의 한 유명 호텔이 최근 홈쇼핑을 통해 숙박 상품을 판매해 빈축을 샀다. 자료 : 온라인 커뮤니티 Copyright ⓒ 서울신문 All rights reserved. 무단 전재-"
고성,"강릉이 길어지는 가뭄 사태로 극심한 물 부족에 시달리고 있는 가운데 가까운 속초는 지난달 물 축제가 성공적으로 열릴 정도로 대조적인 모습이다. 전문가들은 이 같은 차이를 만든 결정적 요인으로 인프라 투자를 꼽았다. 8일 정부의 ‘주간 생활·공업용수 가뭄 현황 및 전망’ 자료에 따르면 강릉의 주요 식수원인 오봉저수지 저수율은 12.5%로, 비가 내리지 않을 경우 저수율은 4주 내 5% 이하로 하락할 것으로 예상됐다. 오봉저수지는 강릉시의 물 공급 87%를 책임지고 있다. 현재 수위는 99.5ｍ로 정상적인 물 공급 한계선인 사수위까지 7ｍ 남았다. 사수란 말그대로 ‘죽은 물’로, 저수지 바닥 아래에 있어 부패가 심하게 진행된 물을 뜻한다. 이에 사수위 위쪽의 물만 공급이 가능하다. 전문가들은 믿을 저수지를 달랑 하나만 두고서 버텨온 강릉을 보면서 ‘예견된 사태’였다고 지적한다. 실제로 강릉의 인접 지역인 양양과 고성, 삼척 등도 소규모 저수지와 지하수를 활용해 가뭄에 대비했다. 덕분에 이번 여름 가뭄 피해를 비껴갈 수 있었다. 속초시는 지난 2018년 극심한 가뭄을 겪은 뒤 지하댐 건설에 나섰다. 당시 수돗물 공급이 수주간 끊기며 아파트 단지에선 격일로 물을 공급했고, 시민들은 급수차에 의존했다. 같은 해 지방선거에서 ‘지하댐 건설’을 공약으로 내세운 김철수 후보가 시장에 당선됐고, 시는 2019년부터 사업을 추진해 2021년에 지하댐을 완공했다. 지하댐은 지하수의 바다 유출을 차단해 저장하는 방식으로, 속초시는 상수원인 쌍천 지하 26m 암반층에 총 280억 원을 투입해 시설을 마련했다. 저장 용량은 63만 톤으로, 약 석 달간 8만여 명이 사용할 수 있는 양이다. 이와 함께 암반 관정 15곳을 추가로 개발했고, 25㎞에 달하는 낡은 상수관을 교체해 유수율도 59%에서 92%까지 끌어올렸다. 이는 전국 평균인 85%를 상회하는 수준이다. 반면 강릉은 대체 수원을 마련하는 데 한참 뒤처졌다. 현재 연곡천 지하댐 건설을 추진 중이지만 완공은 2027년 이후로 예정돼 있다. 연곡정수장 확장 사업도 예산 부족 등으로 지연되고 있다 지난달 30일 강릉을 찾은 이재명 대통령은 강릉시청에서 열린 대책 회의에서 김홍규 시장의 “9월엔 비가 올 것”이라는 발언에 “하나님을 믿으면 안 된다. 사람 목숨을 실험에 맡길 수 없다”고 비판했다. 강릉시 관계자는 “그동안 가뭄 때마다 적시에 비가 내려 투자를 못 한 측면이 있다”며 “작년부터 지하댐 건설에 나섰지만 올해 예상치 못한 ‘돌발 가뭄’이 닥쳤다”고 설명했다. < 저작권자 ⓒ 서울경제, 무단 전재 및 >"
