region,text
태백,"태백산맥이 비구름대 막아 '최악 가뭄' 지속…강수 전망도 어두워 식수원 오봉저수지 저수율 13.5% 기록…전날보다 0.3%p 떨어져 강원 강릉지역이 극심한 가뭄을 겪는 가운데 강릉을 제외한 지역에만 빗줄기가 쏟아지는 일이 반복되면서 강릉시민들 속이 타들어 가고 있다. 4일 강원지방기상청에 따르면 이날 0시부터 오전 10시까지 내린 비의 양은 홍천 47.9㎜, 춘천 29.2㎜, 고성 간성 21㎜, 속초 9㎜, 경포 4.0㎜, 주문진 2.0㎜, 연곡 1.5㎜ 북강릉 1.3㎜, 강릉 0.8㎜ 등이다. 기압골 영향으로 춘천과 홍천 등 내륙·산지 일부 지역에는 아침부터 시간당 10㎜ 안팎의 빗줄기가 쏟아지고, 동풍 영향으로 속초와 고성 등 북부 동해안에는 시간당 3㎜ 안팎의 비가 내리고 있다. 강릉에도 빗방울이 떨어지고 있으나 강수량은 5㎜ 미만에 그칠 것으로 예상된다. 다른 지역에는 제법 많은 비가 내림에도 강릉만 유독 비가 내리지 않는 원인은 지형적인 특성에서 찾을 수 있다. 중부지방 서쪽에서 만들어진 비구름대가 태백산맥을 넘지 못하면서 영서 내륙과 산지에만 많은 비를 뿌리거나, 태백산맥을 넘어오더라도 비구름대가 약화해 찔끔 내리는 수준에 그치고 있다. 기상청은 모레에도 북쪽 상층 기압골이 지나가며 내륙·산지에 강수가 예상되나 동해안은 강수 가능성이 작고, 온다고 하더라도 매우 적은 양이 내릴 것으로 내다보고 있다. 강릉지역 5만3천485가구에 생활용수를 홍제정수장을 거쳐 공급하는 오봉저수지 저수율은 이날 오전 10시 현재 전날보다 0.3%포인트 더 떨어진 13.5%를 기록했다. 반면 수도권과 춘천시민의 식수원인 소양강댐은 66.3%로 많은 양의 물을 모아두고 있다. 지난달 30일 이재명 대통령의 방문 당시 ""9월엔 비가 올 것이라고 굳게 믿고 있다""고 했던 김홍규 강릉시장의 바람과 달리 비가 내리지 않을 경우 오봉저수지 물이 바닥나는 건 시간문제다. 현재 오봉저수지 저수량은 193만t으로, 하루 평균 생활용수 사용량이 8만5천t임을 고려하면 3주가량 버틸 수 있다. 김 시장은 전날 CBS라디오 '김현정의 뉴스쇼'에서 ""기상 상황이 저희에게 그렇게 좋지 않은 것 같다""며 ""지금과 같이 비가 오지 않으면 아마 저수율이 한 10% 이상 떨어질 것 같다""고 말했다. 그는 ""운반급수를 통해 저수율이 10% 아래로 떨어지지 않도록 노력하고 있다""며 ""10% 미만 시 시간제 또는 격일제 단수하는 방안 등을 검토하고 있다""고 밝혔다. 제보는 카카오톡 okjebo <저작권자 연합뉴스, 무단 전재-> 2025/09/04 10:21 송고 2025년09월04일 10시21분 송고"
태백,"4일 기상청이 발표한 분석 결과를 보면 올여름 폭염과 폭우가 반복된 핵심 이유 중 하나는 북태평양 해수면 온도가 높은 점이다. 열대야도 일찍 시작해 대전과 광주, 부산 등 21개 기상관측 지점에서 올여름 역대 가장 이르게 열대야가 나타났다. 이른 더위는 북태평양고기압이 예년보다 일찍 우리나라 남쪽까지 세력을 확장하면서 나타났다. 전체 내용을 이해하기 위해서는 기사 본문과 함께 읽어야 합니다. 송고 2025년09월04일 10시24분 4일 기상청이 발표한 분석 결과를 보면 올여름 폭염과 폭우가 반복된 핵심 이유 중 하나는 북태평양 해수면 온도가 높은 점이다. 열대야도 일찍 시작해 대전과 광주, 부산 등 21개 기상관측 지점에서 올여름 역대 가장 이르게 열대야가 나타났다. 이른 더위는 북태평양고기압이 예년보다 일찍 우리나라 남쪽까지 세력을 확장하면서 나타났다. '극한여름'의 시작은 뜨거운 바다였다. 4일 기상청이 발표한 분석 결과를 보면 올여름 폭염과 폭우가 반복된 핵심 이유 중 하나는 북태평양 해수면 온도가 높은 점이다. ◇ 전국 평균기온 25.7도 1973년 이후 1위…해수면 온도 10년 중 2위 올여름 전국 평균기온은 25.7도로 작년을 제치고 기상 관측망이 전국에 확충돼 각종 기상기록 기준이 되는 1973년 이후 여름 전국 평균기온 중 1위에 올랐다. 최고기온 평균은 30.7도로 평균기온과 마찬가지로 역대 1위, 최저기온 평균은 21.5도로 역대 2위에 해당했다. 폭염일은 28.1일로 세 번째로, 열대야일은 15.5일로 네 번째로 많았다. 우리나라 주변 해역도 올여름 평균 해수면 온도가 23.8도로 작년에 이어 최근 10년 중 두 번째로 높았다. 최근 10년 중 1위는 작년 여름이었다. ◇ 6월 말 시작해 '처서의 마법' 없이 8월까지 무더위 지난해에는 장마가 끝나고 7월 말부터 더위가 시작했다면 올해에는 6월 말부터 더웠다. 6월 29일부터 7월 10일까지 2주간 7월 4일을 빼고 매일 일평균기온이 해당일 기준 역대 1위일 정도였다. 7월 8일엔 경기 광명과 파주 등의 한낮 기온이 40도를 돌파하기도 했다. 열대야도 일찍 시작해 대전과 광주, 부산 등 21개 기상관측 지점에서 올여름 역대 가장 이르게 열대야가 나타났다. 이른 더위는 북태평양고기압이 예년보다 일찍 우리나라 남쪽까지 세력을 확장하면서 나타났다. 6월 말 북태평양고기압이 우리나라를 덮어버리면서 장마를 끝내고 무더위를 가져왔다. 북태평양 해수면 온도가 높고 열대 서태평양에서 대류활동이 활발히 이뤄진 점이 북태평양고기압의 이른 확장을 부른 것으로 분석된다. 해양기후예측센터에 따르면 지난 6월 전 지구 평균 해면 수온은 평년보다 0.4도 높아 1995∼2025년 6월 중 3번째로 높았다. 특히 북태평양과 열대 서태평양은 표준편차를 크게 벗어날 정도로 예년보다 더 뜨거웠다. 뜨거운 북태평양은 북태평양고기압 확장의 '열원'이 됐다. 또 열대 서태평양에서 활발한 대류활동은 우리나라와 일본 쪽 대기 중·하층에 평년보다 고기압이 강하게 발달하도록 만들었다. 바다가 뜨거워 강하게 발달한 고기압들이 우리나라를 빠르게 지나갔다면 더위가 심하지 않았겠지만, 북반구 중위도를 가로질러 'CGT 구조'가 나타나면서 정체했다. CGT 구조는 서유럽부터 북미까지 대기 상층에 고기압과 저기압이 차례로 나타나는 것으로 인도 몬순과 인도 북서부 대류활동 강화와 연관돼있다. 7월 하순과 8월 중·하순엔 밤낮없이 무더위가 이어졌다. 8월 18일부터 25일까지 일평균기온은 해당일 기준으로 역대 1∼2위를 기록했다. 처서 이후까지 무더워 '처서의 마법'은 나타나지 않았다. 이때는 티베트고기압까지 세력을 확장, 북태평양고기압과 티베트고기압이 이중으로 우리나라를 덮으면서 폭염이 나타났다. 특히 8월 중순 이후로 인도 북서부 대류활동이 재차 강화되면서 CGT 구조가 다시 나타나 고기압들을 정체시켜 더위가 지속했다. ◇ 장마 '실종'…전체 강수량 적었지만 '시간당 100㎜' 폭우 13번 올여름 강수량은 619.7㎜로 평년 여름 강수량의 85.1%에 불과했다. 비가 내린 날은 29.3일로 평년보다 9.2일, 1973년 이후 여름 강수일로는 5번째로 적었다. 이는 북태평양고기압이 예년보다 이르게 확장, 장마가 일찍 시작한 대신 매우 짧게 끝났기 때문이다. 올여름 장마는 제주에서 6월 12일, 중부지방과 남부지방에서 6월 19일 시작해 각각 6월 26일과 7월 1일 끝나 15일과 13일밖에 이어지지 않았다. 1973년에 이어 두 번째로 짧은 장마였다. 특히 지난 4월 19일 이후 기상가뭄이 이어지고 있는 강원영동은 올여름 강수량이 평년 강수량의 34.2% 수준인 232.5㎜, 강수일이 평년보다 18.3일 적은 24.7일로 강수량과 강수일 모두 역대 최소였다. 북태평양고기압 영향으로 남서풍이 부는 일이 잦아 태백산맥 동쪽 비가 적었다. 바람은 산을 타고 넘을 때 고온건조해지기 때문이다. 전반적으로 비가 적게 내린 가운데 폭우는 잦았다. 7월 16∼20일 북대서양부터 동아시아까지 중위도 파동이 강화되면서 우리나라 대기 상층으로 찬 공기를 동반한 기압골이 들어왔다가 북태평양고기압에 막혀 빠져나가지 못하면서 전국적으로 200∼700㎜의 매우 많은 비가 내렸다. 또 8월 3∼4일에는 저기압 영향으로 충청 이남에, 9∼14일에는 북태평양고기압 가장자리를 타고 유입된 고온다습한 공기와 대기 상층 기압골에 동반된 찬 공기가 정체전선을 형성하면서 수도권·강원영서·남해안에 호우가 쏟아졌다. 자동기상관측장비 기록을 포함해 올여름 시간당 100㎜ 이상 비가 쏟아진 사례는 7월 17일과 20일 각각 2번, 8월 3일 4번, 8월 13일 5번 등 총 13번이었다. 제보는 카카오톡 okjebo 2025년09월04일 10시24분 송고"
태백,"<앵커> 극심한 가뭄을 겪고 있는 강원 영동 지역의 지난 6월에서 8월 강수량이 기상 관측이래 최저치로 나타났습니다. 또 안전지대로 여겨졌던 대관령에도 처음 폭염이 나타났습니다. 입니다. <기자> 지난여름 강원 영동의 강수량이 전국단위 기상관측이 시작된 1973년이래 최저치를 기록한 것으로 나타났습니다. 기상청은 지난 6월부터 8월 여름철 영동의 강수량이 232.5mm로 평년 679.3mm의 34.2%에 불과했고 강수량과 강수일수 모두 역대 최저치였다고 밝혔습니다. 기상청은 북태평양 고기압의 영향으로 이번 여름 남서풍이 우세한 가운데 태백산맥이 비구름이 넘어오는 걸 가로막아 영동 지역 강수량이 적은 것으로 분석했습니다. 전국 강수량도 619.7mm로 평년 727.3mm의 85% 수준에 그쳤습니다. 비가 짧은 시간 좁은 구역에 집중되면서 지역별 편차는 컸습니다. 지난 7월 17일 서산에 시간당 114mm, 산청에 101mm의 폭우가 쏟아졌고, 7월 20일에는 가평에 시간당 104mm의 비로 피해가 속출했습니다. 8월 3일 무안과 함평에 시간당 140mm 넘는 기록적인 극한 호우가 내렸고, 8월 13일에는 김포와 은평 일대에 시간당 100mm 넘는 비가 와 일대가 침수 됐습니다. 비가 내린 날인 강수일수는 29.3일로 역대 5번째로 적었습니다. 비가 오는 날이 적어 더위는 길게 이어졌습니다. 북태평양 고기압과 티베트 고기압의 영향이 더해지며 여름철 평균기온은 25.7도로 기상 관측사상 가장 더웠습니다. 서울의 열대야 일수는 46일로 1908년 기상관측 시작이래 가장 많았습니다. 광주는 역대 가장 빠른 6월 19일에 열대야가 시작됐고, 부산 등 전국 21개 지역에서 가장 빠른 열대야가 관측됐습니다. 고도가 높아 폭염 안전지대로 알려진 대관령에도 처음으로 폭염이 나타났습니다. 대관령 기온은 1971년 해당 지역 관측이 시작된 이래 단 한 번도 폭염 기준인 33도를 넘은 적이 없었습니다. 그런데 지난 7월 26일 기온이 처음으로 33.1도까지 치솟았고 다음날 33.2도까지 오르며 이틀간 폭염이 나타난 겁니다. 기상청은 기후변화로 폭염, 집중호우, 가뭄 등 극한 현상이 동시다발적으로 발생해 여름이 양극화되고 있다며 달라지는 기상재해 양상을 면밀히 분석하겠다고 밝혔습니다."
태백,"올여름 평균기온 25.7도…충남권 25.9도 1위 이례적 이른 더위에 ‘열돔 현상’까지 더해져 2025년이 ‘역대 가장 더운 여름’의 타이틀 홀더로 등극했다. 지난해 기록을 갈아치우면서다. 올여름엔 이례적으로 이른 더위가 찾아왔고 북태평양고기압과 티베트고기압의 합작으로 ‘열돔 현상’이 나타나면서 기록적인 폭염을 완성했다. 또 어김없이 집중호우가 쏟아지면서 곳곳이 수해로 멍들었다. 비가 내린 날은 적었지만 국지적으로 단시간에 퍼붓는 집중호우의 특성이 두드러졌다. ◆역대급, 기록적인 폭염 4일 기상청에 따르면 올여름 전국 평균기온은 25.7도로 1973년 이후 역대 가장 더웠던 지난해보다 0.1도 높았다. 1년 만에 기록 경신이 이뤄진 거다. 평년보단 2도나 높은 수준이다. 평균 최고기온도 30.7도로 역시 역대 1위이고 평균 최저기온은 21.5도로 지난해에 이어 2위를 기록했다. 이례적으로 빨리 찾아온 더위가 가장 큰 원인으로 지목된다. 장마철 이후인 7월 말부터 본격적인 무더위가 시작되는 패턴과 달리 올해는 한 달가량 일찍 더위가 찾아왔다. 6월 29일부터 7월 10일까지 2주간 7월 4일을 제외하곤 매일 일평균기온이 역대 1위를 찍었다. 7월 8일엔 경기도 일부지역에서 낮 최고기온이 40도를 돌파하기도 했다. 열대야도 일찍 나타났다. 대전을 비롯해 전국 21개 기상관측지점에서 역대 가장 이른 열대야가 기록됐다. 6월 말 이른 더위가 나타난 건 열대 서태평양의 활발한 대류 활동과 북태평양의 높은 해수면 온도로 인해 덥고 습한 북태평양고기압이 예년보다 일찍 우리나라로 세력을 확장한 데 따른 것이고 7월 하순부턴 티베트고기압의 영향도 더해지면서 기온이 더욱 상승했다. 두 고기압이 한반도를 이중으로 덮어버리면서 열돔 현상, 즉 지표면에서 데워진 뜨거운 공기가 빠져나가지 못하고 돔에 갇힌 것처럼 열기가 축적돼 기록적인 폭염이 나타났다는 게 기상청의 설명이다. 올여름 우리나라 주변 해수면 온도는 23.8도로 지난해에 이어 최근 10년 새 두 번째로 높았다. 이런 영향으로 7월과 8월엔 밤낮으로 무더위가 지속됐다. 특히 8월 18일부터 25일까지 전국 일평균기온은 매일 역대 1∼2위를 기록했다. 더위가 그치는 ‘처서의 마법’도 올여름엔 나타났지 않았다. 8월 하순 전국 평균기온은 27.8도로 평년보다 3.9도나 높아 역대 1위를 경신했다. 올여름 전국 폭염일수는 28.1일로 평년 대비 17.5일 많았다. 2018년 31일, 1994년 28.5일에 이어 역대 3번째로 많은 수준이다. 남부지방과 동해안을 중심으로 20개 지점에서 관측이래 가장 많은 폭염일수를 기록했고 대관령에선 1971년 관측 이래 처음으로 폭염이 발생했다. 열대야일수는 15.5일로 평년보다 9일 많았다. 2024년 20.2일, 2018년 16.5일, 1994년 16.5일에 이어 역대 4위다. 특히 서울은 열대야일수가 평년 대비 3.5배가 넘는 46일로 역대 1위였던 지난해 기록을 갈아치웠다. 대전과 세종을 포함한 충남권의 올여름 평균기온 역시 평년보다 1.8도 높은 25.9도로 역대 1위 기록을 경신했다. 평균 최고기온은 30.9도로 1994년에 이어 2위, 평균 최저기온은 21.7도로 역대 1위다. 폭염일수는 27.3일로 평년보다 17.2일 많았다. 2018년 32.8일, 1994년 32일에 이어 역대 3위다. 열대야일수는 16일로 평년보다 9.9일 많았다. 2024년 21.6일, 1994년 19.5일, 2018년 17.2일에 이어 역대 4위다. ◆국지성 집중호우 경향 뚜렷 올여름 전국 일수일수는 29.3일로 평년보다 9.2일 적었고 강수량은 619.7㎜로 평년의 약 85% 수준을 보였다. 장마가 일찍 시작한 대신 매우 짧게 끝난 탓이다. 올여름 장마는 제주에서 6월 12일, 중부와 남부지방은 6월 19일 시작했고 평년보다 각 7일, 6일, 4일 빠르게 종료됐다. 기간도 짧고 정체전선이 남북으로 오가며 장맛비가 내리기보다 6월 20∼21일, 7월 중순 한두 차례 많은 비가 집중적으로 내렸다. 올 장마철 강수량은 200.5㎜로 평년의 55% 수준에 머물렀다. 장마철 강수일수 역시 8.8일로 평년의 절반 수준, 역대 네 번째로 적었다. 4월 19일 이후 기상가뭄이 이어지고 있는 강원영동지방은 강수량이 232.5㎜로 평년의 34.2% 수준이었다. 강수일수도 24.7일로 평년보다 18.3일 적어 여름철 강수량과 강수일수 모두 역대 가장 적었다. 이 지역의 경우 태백산맥으로 인한 지형효과로 강수량이 더욱 적었고 여름 내내 북태평양고기압의 영향으로 남서풍이 우세해 동풍 계열의 바람이 불지 않아 강수량이 매우 적었다. 올여름 강수가 국지적으로 단시간에 집중되는 경향은 뚜렷했다. 특히 7월 중순과 8월 전반엔 기록적인 호우가 내렸다. 7월 16∼20일, 중위도 파동 강화로 인한 상층 찬 공기를 동반한 기압골의 영향을 지속적으로 받아 전국적으로 200∼700㎜의 매우 많은 비가 내렸고 충남 서산과 경남 산청 등에선 1시간최다강수량이 100㎜를 넘었다. 또 8월 3∼4일에는 저기압의 영향으로 충청이남에, 9∼14일엔 북태평양고기압 가장자리를 따라 유입된 고온 다습한 공기와 상층 기압골에 동반된 찬 공기 사이에서 형성된 정체전선의 영향으로 수도권, 강원영서, 남해안을 중심으로 많은 비가 내렸다. 자동기상관측장비 기록을 포함해 올여름 시간당 100㎜이상 비가 쏟아진 건 7월 17일 서산·산청을 비롯해 8월 3일 전남 함평·무안 등 13번이다. 올여름 충남권 강수일수는 27.8일로 평년보다 10일 적었지만 강수량은 711.8㎜로 평년과 비슷했다. 장마기간 강수일수는 12.8일로 평년보다 적었지만 강수량은 503.8㎜로 평년 대비 142.4% 많은 수준을 보였다. 7월 17일 서산에선 1시간에 114.9㎜의 폭우가 쏟아지기도 했다."
태백,"4일 강원지역은 대체로 흐린 가운데 비 소식이 있겠다. 강원지방기상청에 따르면 예상 강수량은 영서 내륙·산지 5∼40㎜, 강원 북부 동해안 5∼20㎜다. 극심한 가뭄을 겪는 강릉을 비롯한 강원 중·남부 동해안은 5mm 미만의 비가 내리겠다. 인공지능이 자동으로 줄인 '세 줄 요약' 기술을 사용합니다. 전체 내용을 이해하기 위해서는 기사 본문과 함께 읽어야 합니다. 전체 내용을 이해하기 위해서는 기사 본문과 함께 읽어야 합니다. 송고 2025년09월04일 06시24분 4일 강원지역은 대체로 흐린 가운데 비 소식이 있겠다. 강원지방기상청에 따르면 예상 강수량은 영서 내륙·산지 5∼40㎜, 강원 북부 동해안 5∼20㎜다. 극심한 가뭄을 겪는 강릉을 비롯한 강원 중·남부 동해안은 5mm 미만의 비가 내리겠다. 4일 강원지역은 대체로 흐린 가운데 비 소식이 있겠다. 강원지방기상청에 따르면 예상 강수량은 영서 내륙·산지 5∼40㎜, 강원 북부 동해안 5∼20㎜다. 극심한 가뭄을 겪는 강릉을 비롯한 강원 중·남부 동해안은 5mm 미만의 비가 내리겠다. 낮 최고 기온은 내륙 26∼28도, 산지 22∼25도, 동해안 25∼28도 분포를 보이겠다. 강원지방기상청은 ""비가 내리는 지역에서는 돌풍과 함께 천둥, 번개가 치는 곳이 있겠으니 시설물 관리와 안전사고에 유의해야 한다""고 당부했다. 한편 최악의 가뭄 사태를 맞고 있는 강릉지역의 생활용수 87%를 공급하는 오봉저수지 저수율은 이날 현재 13.6%로 전날보다 0.2%포인트 떨어졌다. 제보는 카카오톡 okjebo 2025년09월04일 06시24분 송고"
태백,"반복된 폭염과 폭우로 몸살을 앓고 있는 올해 여름 강원지역 평균기온이 역대 1위를 기록했다. 청정고원으로 불리는 태백 지역은 평균 최고기온이 관측 이래 최고치를 기록했던 반면 강수량은 최저치를 보이면서 가뭄 발생 우려로 이어지고 있다. 5일 강원기상청이 발표한 '2025년 여름철 강원특별자치도의 기후 특성과 원인에 대한 분석 결과'에 따르면 강원지역 여름 평균기온은 24.9도로 역대 최고 1위 기온을 경신했다. 폭염일수는 20.6일로 역대 2위를 기록했으며 평년 대비 2.7배나 많았다. 대관령은 1971년 관측 이래 처음으로 폭염이 발생했다. 열대야일수는 10.9일로 역대 2위였으며 평년 대비 3.1배에 달했다. 철원에서는 1988년 관측 이래 가장 이른 열대야가 기록됐다. 같은기간 평균 강수량은 433.2㎜로 평년 대비 54.6%에 불과했다. 영동의 경우 232.5㎜로 평년 대비 34.2% 밖에 되지 않았다. 강수일수도 29.9일로 평년 보다 적었다. 강릉을 강타한 '극한 가뭄'은 푄 현상 때문이다. 푄현상은 바람이 산맥을 넘으며 고온건조해지는 현상을 일컫는데, 올해 여름 태백산맥을 넘은 남서풍이 영서지역에 비를 뿌리고 영동지역으로 넘어가면서 극심한 더위가 이어졌기 때문이다. 강원 강릉시 오봉저수지 일대 하천의 바닥이 드러나 있다. 강릉=청정고원으로 불리는 태백지역의 분위기도 심상치 않다. 기상청 관측결과 올 여름 태백지역 평균기온은 23.2도, 평균 최고기온은 29.1도로 1985년 관측 이래 40년 만에 가장 높았다. 반면 같은기간 합계 강수량은 233.3㎜로 역대 최저치를 기록하면서 강수량 부족에 시달리고 있다. 이로 인해 태백지역의 생활용수를 공급하고 있는 광동댐 저수율이 40% 아래로 떨어지면서 가뭄 위기 우려가 커지고 있다. 국가수자원관리종합시스템에 따르면 전날 광동댐 저수율은 38.9%로 한 달 만에 10%나 급감했다. 현재 수위는 667.2m, 저수량 510만㎥로 태백시는 당장 용수 공급에는 큰 차질이 없을 것으로 예상하고 있으나 이번주 가뭄 '관심' 단계에 이를 것으로 전망돼 대책 마련에 나섰다. 가뭄 지속 상황을 대비해 단기적 생활용수 절약 지침을 배포하고 지역 오투리조트 담수보와 황지연못, 화전정수장 취수구 등을 화용한 급수 대책을 검토 중이다. 이상호 태백시장은 ""가뭄 상황에는 선제 대응이 무엇보다 중요하다""며 ""시민들이 안심하고 일상생활을 할 수 있도록 단계별 대응을 철저히 이행하고, 물 절약에도 적극 동참해 주시길 바란다""고 말했다."
태백,"주말 가뭄 관심단계 진입 예상 이 시장 용수댐 운영 현황 점검 화전정수장 등 취수 활용 검토 강릉이 최악의 가뭄사태로 재난지역으로 선포된 가운데 인근 지자체인 태백지역도 40%의 저수율이 붕괴되면서 가뭄위기가 현실화되는 것 아니냐는 우려감이 높아지고 있다. 지난 1988년 준공된 광동댐을 용수원으로 한 생활용수는 광동취수장과 황지정수장 거쳐 태백지역은 물론, 삼척시·정선군에 공급되고 있다. 하지만 예년의 절반도 안되는 강수량에 광동댐의 저수율이 40%대가 붕괴돼 39%를 기록, 이번주말 쯤 가뭄 관심단계 진입이 예상된다. 태백지역의 올해 강수량은 4일 현재 예년의 46.9%에 불과한 442.3㎜을 기록중이다. 적은 누적 강수량에 광동댐 유입량도 예년의 23%로 급감했으며 저수율도 평년의 61% 수준인 39%로 하락했다. 최대 1300만㎥의 물을 저장할 수 있는 광동댐의 현재 저수량은 예년 대비 60.9% 수준이다. 계속해서 비가 오지 않을 경우, 태백지역은 7일 관심, 14일 주의, 10월초 심각 단계로 진입할 것으로 예상된다. 이에따라 태백시와 수자원공사 등 관계 당국이 ‘단계별 가뭄 대응 계획’ 시행을 추진하는 등 대책 마련을 서두르고 있다. 이상호 시장은 3일 광동댐을 방문, ‘가뭄 대응 계획’을 점검했다. 이 시장은 마른 장마 영향 등 강우 부족으로 용수댐이 가뭄 단계 진입이 예상됨에 따라 안정적 용수 공급을 위한 선제 대응을 주문했다. 태백시는 7일 관심단계 발령이 예상됨에 따라 시민들에게 세탁·세면·조리 등 생활용수 절약 실천 지침을 배포했다. 또 오투리조트담수보·황지연못·화전정수장 등을 취수에 활용하는 방안을 검토하고 있다. 특히 정선 고한와 사북에 대한 제한급수도 검토하는 등 가뭄에 즉시 대응한다는 계획이다. 주의단계에 접어들 경우, 전체 실사용량의 10%를, 심각단계에 들어서면 20%를 제한급수를 시행해 생활용수를 공급하게 된다. 이상호 태백시장은 “가뭄 상황에는 선제적 대응이 무엇보다 중요하다”며 “시민들이 안심하고 일상생활을할 수 있도록 단계별 대응을 철저히 이행하고, 물 절약에도 적극 동참해 달라”고 말했다."
